0,2052148813,Fri Jun 05 23:48:34 PDT 2009,NO_QUERY,siyaadah,"Got caught up answering stuff in Yahoo!Answers.Hmm,my apologies twitterverse!!Lots to do 2mrw  So goodnight."
0,2052148901,Fri Jun 05 23:48:35 PDT 2009,NO_QUERY,Nu10RllyMatters,SHOOT ME!!!! SHOOT ME NOW!!!!! UUUUUUUUGGGGGGGGHHHHHHHHHH IM SOOOO EFFIN BORED AND CANT SLEEP GRRR 
0,2052149000,Fri Jun 05 23:48:36 PDT 2009,NO_QUERY,msklassy,@blaclipz I was. I always wake up a couple times during the night 
0,2052149131,Fri Jun 05 23:48:38 PDT 2009,NO_QUERY,DoveSweet,should b sleepin but im sitting under the dryer gotta try n get the hair decent 4 school 2morrow 9-5 so sad... so sad... 
0,2052149158,Fri Jun 05 23:48:38 PDT 2009,NO_QUERY,scribblegurl,@nineonefour i hope it feels better soon.  and that sucks. 
0,2052149553,Fri Jun 05 23:48:43 PDT 2009,NO_QUERY,bendur,not as good at super smash bros 64 as I remember 
0,2052149727,Fri Jun 05 23:48:45 PDT 2009,NO_QUERY,girlwithapuck,exhausted............... and it doesnt slow down tmrw. 
0,2052150181,Fri Jun 05 23:48:50 PDT 2009,NO_QUERY,macksimumrage,"The PSP lineup for '09 is looking pretty solid, i might have to pick one up... But the Go is too far away "
0,2052150198,Fri Jun 05 23:48:50 PDT 2009,NO_QUERY,Indra_Wiguna,Missing someone 
0,2052150386,Fri Jun 05 23:48:52 PDT 2009,NO_QUERY,MiDesfileNegro,Oranges are disgusting. That level of gross-ness should be illegal 
0,2052151409,Fri Jun 05 23:49:05 PDT 2009,NO_QUERY,AliConstantine,@swear_bot Sorry     
0,2052151801,Fri Jun 05 23:49:09 PDT 2009,NO_QUERY,mydefpony,I tried to pick up my 105 pound dog and accidently fingered it's asshole 
0,2052151921,Fri Jun 05 23:49:10 PDT 2009,NO_QUERY,zombiesheep,Note to self : hangovers are not fun. 
0,2052151946,Fri Jun 05 23:49:11 PDT 2009,NO_QUERY,mattpro13,when are you coming over  @Sarah_Hyland
0,2052152068,Fri Jun 05 23:49:12 PDT 2009,NO_QUERY,xgrundieheadx,@Emmy56 hahahahahahahahahaha that is way too funny! and i bet i cant tell anyone that  *sobs* lol
0,2052152094,Fri Jun 05 23:49:12 PDT 2009,NO_QUERY,joestxgirl,@_writersblock_ im tryin to chat but it wont let  me 
0,2052152752,Fri Jun 05 23:49:20 PDT 2009,NO_QUERY,kianatweets,just wrote a really fun song! But I need guitar  anyone?
0,2052152804,Fri Jun 05 23:49:21 PDT 2009,NO_QUERY,yahayraarteaga,"lost wallet today :// so i lost school I.D., library card, &amp; 20 bucks  palm springs tomorrow &lt;3"
0,2052153038,Fri Jun 05 23:49:23 PDT 2009,NO_QUERY,heyysusana,"This is just like last time. I'll be dreading it, but still feel fine until the day of, then I'll go crazy "
0,2052153541,Fri Jun 05 23:49:29 PDT 2009,NO_QUERY,neosolrkstr,My notebook looks like chicken scratch!  I need a muse...
0,2052153730,Fri Jun 05 23:49:31 PDT 2009,NO_QUERY,_writersblock_,I guess @joeymcintyre isnt gonna come play with us ladies  thats alright...there's always tomorrow ;)
0,2052153771,Fri Jun 05 23:49:31 PDT 2009,NO_QUERY,itsNaida,"@missvina I knowww rite, tapi bad thing aku sakit "
0,2052153804,Fri Jun 05 23:49:31 PDT 2009,NO_QUERY,Jsh3281,Just got home from pueblo 
0,2052154525,Fri Jun 05 23:49:39 PDT 2009,NO_QUERY,francoisplanque,shh!t it's saturday already. Too late to sell USD for this week  #EURUSD
0,2052154966,Fri Jun 05 23:49:45 PDT 2009,NO_QUERY,Eganaholic,"Tanja is here, but so is the rain!! "
0,2052154985,Fri Jun 05 23:49:45 PDT 2009,NO_QUERY,yvienoemy,Im at a taco place. They take forever. 
0,2052155114,Fri Jun 05 23:49:46 PDT 2009,NO_QUERY,ellaxceleste,@mikeyswag i'll cop before i go to work and pregame on the train lol  (sad what my life has turned into)
0,2052155155,Fri Jun 05 23:49:47 PDT 2009,NO_QUERY,RudySpeaks,Watching &quot;Gone Baby Gone&quot;.  Got a feeling this one's gonna be a  TearJerker. Just what I need..more of a runny nose than I already  have! 
0,2052155399,Fri Jun 05 23:49:50 PDT 2009,NO_QUERY,OmarMartin,@PaulaBrett Hey You! Made it home ok ?  I've got bronchitis  Let me know how u want to do the signup thingy on your mod...
0,2052155469,Fri Jun 05 23:49:50 PDT 2009,NO_QUERY,AmmoxXx,I'm wearing my uniform on a Saturday 
0,2052155538,Fri Jun 05 23:49:51 PDT 2009,NO_QUERY,odessamohney,''i love you but i hate the things you do.'' fuck. 
0,2052155649,Fri Jun 05 23:49:53 PDT 2009,NO_QUERY,albertren,"@roooooland i was afraid of that, but unfortunately there are less of you relative to facebook. Sorry! "
0,2052156236,Fri Jun 05 23:49:59 PDT 2009,NO_QUERY,xQuietStormx,@UShannon my feelins hurt...supa dupa sad face: 
0,2052156413,Fri Jun 05 23:50:01 PDT 2009,NO_QUERY,hankk_G,I was gonna camp for the yeezys but by wensday there was already like 15 ppl infront of each store that's releasing them 
0,2052156417,Fri Jun 05 23:50:01 PDT 2009,NO_QUERY,anyzaxdawn,"geez, im tired, but still have alot of things to do !!!!!!!!! "
0,2052156594,Fri Jun 05 23:50:03 PDT 2009,NO_QUERY,sammym,it's 2 am and i all want to do is play rollercoaster tycoon but i cant find my disc anywhere 
0,2052157047,Fri Jun 05 23:50:07 PDT 2009,NO_QUERY,leetuhbby,no more short hair ; dont care. my hair is back to my shoulders. almost my back   qrrr! imma cut it aqain.
0,2052157064,Fri Jun 05 23:50:07 PDT 2009,NO_QUERY,tjtrapp,"@whyshiroma that sux, sorry "
0,2052157283,Fri Jun 05 23:50:09 PDT 2009,NO_QUERY,_mhawk,@AmorAng lucky yall. . . morning meeting @ 7am  it's all bad
0,2052157310,Fri Jun 05 23:50:10 PDT 2009,NO_QUERY,indieplanet,"@WordofSouth Add some Crown to that Apple Juice or Cranberry and you might have something. Without, its just juice "
0,2052157773,Fri Jun 05 23:50:14 PDT 2009,NO_QUERY,nkotb77fan,"@JonathanRKnight I can't believe u like dat show. Its my favorite show! I hate dat its on so late on sunday, gotta work da next day "
0,2052158459,Fri Jun 05 23:50:22 PDT 2009,NO_QUERY,libster_t,"Hiya, I forgot say G'night last night "
0,2052158932,Fri Jun 05 23:50:28 PDT 2009,NO_QUERY,Cherriepeye,you know what i think?? i think its time for a goodnight.. so good night and i am going to bed caue i have to get up at 7 ... yay!!! 
0,2052158976,Fri Jun 05 23:50:28 PDT 2009,NO_QUERY,robeubank,Just found out that a friend was arrested for mortgage fraud. 
0,2052159036,Fri Jun 05 23:50:29 PDT 2009,NO_QUERY,evilmaharaja,MMk now to play some inFamous.. getting a lil tired now 
0,2052159081,Fri Jun 05 23:50:29 PDT 2009,NO_QUERY,t2therell,@FASHIONISMYLIFE Likewise 
0,2052159087,Fri Jun 05 23:50:30 PDT 2009,NO_QUERY,tito_da_munky,@beardoctor tito kant lowd da paj und hath ta gow tu beyd naow 
0,2052159473,Fri Jun 05 23:50:33 PDT 2009,NO_QUERY,h3rmanator,"Summer is so close but so far away.  Writing portfolio, biotech final, chem final."
0,2052159581,Fri Jun 05 23:50:35 PDT 2009,NO_QUERY,ravenforgest,@LaurenConrad The hills wouldn't be the same without you  But I understand all good things come to  an end.
0,2052159599,Fri Jun 05 23:50:35 PDT 2009,NO_QUERY,riteshmaity,is heading towards a hectic Saturday. 
0,2052159673,Fri Jun 05 23:50:36 PDT 2009,NO_QUERY,dianeswlee,"@bridgers I'd love to visit you, but my car died. "
0,2052159837,Fri Jun 05 23:50:37 PDT 2009,NO_QUERY,ilovevanilla,I can't believe I'm in a Filipino Philo class  How am I going to survive?
0,2052159889,Fri Jun 05 23:50:38 PDT 2009,NO_QUERY,ohmyginaness,nightt. ugh gotta get to cycling by 8am tomorrow 
0,2052159906,Fri Jun 05 23:50:38 PDT 2009,NO_QUERY,fobluv3r,"@aappril no i cant.  I was sleepy when i was on the couch, bt when i went to my room my sleep went away."
0,2052160080,Fri Jun 05 23:50:40 PDT 2009,NO_QUERY,RobertMah,finals next week  study study study
0,2052160280,Fri Jun 05 23:50:42 PDT 2009,NO_QUERY,markthebanana,"Hmmm, Natures almost brutally adervtised SciBx is obviously not accessible through my library "
0,2052160400,Fri Jun 05 23:50:43 PDT 2009,NO_QUERY,Cheekynath,Rain rain and more rain! I cannie believe that in 3 sleeps I'll be back on that plane 
0,2052160489,Fri Jun 05 23:50:44 PDT 2009,NO_QUERY,bridgettesharp,im cold  brrrrr!
0,2052160533,Fri Jun 05 23:50:44 PDT 2009,NO_QUERY,cimangss,@youngparmesan Writer's block? Tell me 'bout it 
0,2052160963,Fri Jun 05 23:50:49 PDT 2009,NO_QUERY,Afrodisiaq,"@Sub7ero Oh, wow...next weekend   tell him I'm requesting a live screw session cd, lol."
0,2052160981,Fri Jun 05 23:50:49 PDT 2009,NO_QUERY,WHO_IShe,@ Pravada with the girls...nite almost over   dont want it 2 end!
0,2052161882,Fri Jun 05 23:51:00 PDT 2009,NO_QUERY,SusieEmily,its too hot in Asia right now 
0,2052161898,Fri Jun 05 23:51:00 PDT 2009,NO_QUERY,poochy62,I have no access to my facebook account. It's stuffed up!  
0,2052161954,Fri Jun 05 23:51:01 PDT 2009,NO_QUERY,pinkishvalery,"Just played ping pong competition,, and, and, I lost in semi-finals.. quite sad "
0,2052162114,Fri Jun 05 23:51:02 PDT 2009,NO_QUERY,Luciddreamrc123,"@Dave_Chappelle Yo dave, still play wow? haha i was trying to find you on the armory cause i read somewhere you have a rogue. No luck "
0,2052162216,Fri Jun 05 23:51:04 PDT 2009,NO_QUERY,xoxstina,Well FML I just remember that I forgot my retainers. 
0,2052162366,Fri Jun 05 23:51:06 PDT 2009,NO_QUERY,nattywittagatty,Just won't up because of the loud thundering and lightning!!! I am terrified. Did I ever mention that? Yea... 
0,2052162415,Fri Jun 05 23:51:06 PDT 2009,NO_QUERY,jamesparton,"typical, rain to spoil party plans "
0,2052162659,Fri Jun 05 23:51:09 PDT 2009,NO_QUERY,Extra_Gorgeous,I need a massageeeeeee asap 
0,2052162755,Fri Jun 05 23:51:10 PDT 2009,NO_QUERY,WhoisMarques,@Golden_Lady that sucks we dnt get to hear what happened 
0,2052162933,Fri Jun 05 23:51:11 PDT 2009,NO_QUERY,wilsonfkp,"@noonnoon wow! yam cha, i wish i could do the same but it's just me here... "
0,2052163002,Fri Jun 05 23:51:12 PDT 2009,NO_QUERY,fadedmoon,"@AmyyVee sadly, it did not...  (when I was awake that is....)"
0,2052163012,Fri Jun 05 23:51:12 PDT 2009,NO_QUERY,remixxxd,Wonderin why all my tweets arenot showing.... What thee hell?? 
0,2052163101,Fri Jun 05 23:51:13 PDT 2009,NO_QUERY,lauqhinqlaura,@snapcrackleDIAN imy soo much  we always text on days like this...
0,2052163248,Fri Jun 05 23:51:15 PDT 2009,NO_QUERY,aye_paige,@Squeaksz : you are missed 
0,2052164484,Fri Jun 05 23:51:28 PDT 2009,NO_QUERY,biteofcake,My Tummy hurts 
0,2052164495,Fri Jun 05 23:51:28 PDT 2009,NO_QUERY,MAYRALOVE,Uggg why can't I fall asleep...oh wait yah it's that damn beagle!!  chunk of love better be grateful I'm taking this torture pup!
0,2052164502,Fri Jun 05 23:51:28 PDT 2009,NO_QUERY,cshawyer,@joshglid   That's not good .. just go with it and it will lift.
0,2052164519,Fri Jun 05 23:51:28 PDT 2009,NO_QUERY,ian_ford,"Jester is poorly. Being sick, not eating or drinking. Looks like a trip to the vets is in order. He's never been off his food in 4 years "
0,2052164544,Fri Jun 05 23:51:29 PDT 2009,NO_QUERY,lilmz1986,I can't sleep got too much on my mind 
0,2052164702,Fri Jun 05 23:51:30 PDT 2009,NO_QUERY,gamwyn,Rounded out Spider-tastic week with Spidey 3. *sniffle* Peter and Harry made a great crime-fighting duo. Too bad it was so short lived. 
0,2052164797,Fri Jun 05 23:51:31 PDT 2009,NO_QUERY,Curvycutiepie05,Goodnight: Time to dream about the man I love who's over a thousand miles away with another woman 
0,2052164809,Fri Jun 05 23:51:32 PDT 2009,NO_QUERY,amore_eterno,Later today my cable is being installed. Yay!  My back molar is hurting  Ouchies.
0,2052165084,Fri Jun 05 23:51:35 PDT 2009,NO_QUERY,iGuido85,Damn.. Red Sox defeated by Texas Rangers at Fenway park..! 
0,2052165147,Fri Jun 05 23:51:36 PDT 2009,NO_QUERY,Summer_Justian,dog+sprayed by skunk=me having to bathe her in tomato juice in the morning! 
0,2052165400,Fri Jun 05 23:51:39 PDT 2009,NO_QUERY,thee_shardae,Fckn head hurts lk hell AGAIN. Ugh n I cnt even sleep 
0,2052165487,Fri Jun 05 23:51:39 PDT 2009,NO_QUERY,siumuimui,so what to do now? Don't tell me we got to say bye bye to flickr from now on 
0,2052165555,Fri Jun 05 23:51:40 PDT 2009,NO_QUERY,Diana54x,Is bummed that she cant go out today 
0,2052165937,Fri Jun 05 23:51:45 PDT 2009,NO_QUERY,NoahReich,"I still can't get over Up! I don't I've cried that hard in a movie in a long time. Streams of tears, my face is so much thinner now! "
0,2052166004,Fri Jun 05 23:51:45 PDT 2009,NO_QUERY,yellowheart,@n_davis07 i dnt think ill be able to get off work i have 0 seniority 
0,2052166094,Fri Jun 05 23:51:46 PDT 2009,NO_QUERY,linz_82,mad that ive missed every Conan show this week...  ...except for tonite! yes! :]
0,2052166267,Fri Jun 05 23:51:48 PDT 2009,NO_QUERY,justtaylorr,Holy shit pop-lock &amp; drop it murdered my legs tonight. They hurt so bad hahahahah. I'm out of shape 
0,2052166346,Fri Jun 05 23:51:49 PDT 2009,NO_QUERY,justintanoue,"I have a fever  But... I pop a couple of pills and still show up to work, cause I'm a manager!"
0,2052166400,Fri Jun 05 23:51:50 PDT 2009,NO_QUERY,ThePlotHole,@dragonflyb You're allergic to peanut butter? That is the saddest thing I have ever heard 
0,2052166426,Fri Jun 05 23:51:50 PDT 2009,NO_QUERY,piglette,@jyvegas *hug* that's so sad... sorry again. 
0,2052166856,Fri Jun 05 23:51:55 PDT 2009,NO_QUERY,denissepmp,@fernandasymonds i miss you  where are you slut? :W
0,2052167071,Fri Jun 05 23:51:57 PDT 2009,NO_QUERY,valdivia1,@CinRox awww  I'm sorry...do u want nuts? How bout nuts in ur face?
0,2052167344,Fri Jun 05 23:52:00 PDT 2009,NO_QUERY,shifty_win,Time for me to go home but its still raining outside.. 
0,2052167359,Fri Jun 05 23:52:00 PDT 2009,NO_QUERY,elvenjen,@BarryZito Where've you been all week? No laptop on the road trip?  Good win today!
0,2052167604,Fri Jun 05 23:52:03 PDT 2009,NO_QUERY,raahima,2 ppl unfollowed me 
0,2052167726,Fri Jun 05 23:52:04 PDT 2009,NO_QUERY,tarzan_0802,@EmmettAgapay I want to go 
0,2052168162,Fri Jun 05 23:52:09 PDT 2009,NO_QUERY,Johnjoshua,With danny at rage..this is the ear he can't hear out of  http://twitpic.com/6q9wj
0,2052168235,Fri Jun 05 23:52:10 PDT 2009,NO_QUERY,robotwiener,wanna see someone  also want a veggie wedgie from sully's
0,2052168425,Fri Jun 05 23:52:12 PDT 2009,NO_QUERY,linz_82,mad that ive missed every Conan show this week...  ...except for tonite! yes! :] e's still my fave......!
0,2052169210,Fri Jun 05 23:52:20 PDT 2009,NO_QUERY,apeskinny,Don't wanna be up &amp; awake 
0,2052169266,Fri Jun 05 23:52:21 PDT 2009,NO_QUERY,dobler,@aleximelvin they've been airing the final 3 episodes the last week or so. Great tv cancelled before it's time 
0,2052169568,Fri Jun 05 23:52:24 PDT 2009,NO_QUERY,linz_82,mad that ive missed every Conan show this week...  ...except for tonite! yes! :] he's still my fave......!
0,2052169631,Fri Jun 05 23:52:25 PDT 2009,NO_QUERY,imcute519,@skylerevers  i did jenna's 50 random q's vid but 4 some reason there is zero sound except in the webcam playback  im trying 2 fix it tho!
0,2052169647,Fri Jun 05 23:52:25 PDT 2009,NO_QUERY,mikaya_888,nighty night... so dont wanna go to class tomorrow  Proverbs 4:11
0,2052169724,Fri Jun 05 23:52:26 PDT 2009,NO_QUERY,NancyCubbins,@KillxYourxEgo yes.. I have a very expensive magician coming. And thank you for your good thoughts. The first surgery is this Tuesday!!! 
0,2052170066,Fri Jun 05 23:52:30 PDT 2009,NO_QUERY,JavaJanexoxo,"@Midnitwisp Babykins, where are you? I'm having withdrawals. Talk to me, Hon. "
0,2052170118,Fri Jun 05 23:52:30 PDT 2009,NO_QUERY,Sweethart24871,Can't sleep.....don't know how to make it better 
0,2052170310,Fri Jun 05 23:52:32 PDT 2009,NO_QUERY,monu_225,antibiotics for kids ? is it safe ?  hope minna will be fine by today
0,2052170538,Fri Jun 05 23:52:35 PDT 2009,NO_QUERY,sweedzie,OMG OMG tomorrow interview for AFS... i just can't help but keep imagine how it will be.  @jasmine_nia how bout u?
0,2052170851,Fri Jun 05 23:52:39 PDT 2009,NO_QUERY,MuzikGurl00,@asiariffic  what happened? why's ur heart in pain?
0,2052171085,Fri Jun 05 23:52:41 PDT 2009,NO_QUERY,AzaIza,; My hair is no longer long  
0,2052171135,Fri Jun 05 23:52:42 PDT 2009,NO_QUERY,PenelopeHeart,Not pleased with the early morning and rain  booooo! Wales tonight! Crazy! x
0,2052171167,Fri Jun 05 23:52:42 PDT 2009,NO_QUERY,swaggerbits,misses dancecom training... 
0,2052171319,Fri Jun 05 23:52:44 PDT 2009,NO_QUERY,courtneystorrie,@cdnsma ahhh are you serious how come? ugh i'd die without it 
0,2052171579,Fri Jun 05 23:52:47 PDT 2009,NO_QUERY,nevillez,DAMNN! There's a fucking massive scratch on my phone's screen  It's sooo big. Urgh.
0,2052171726,Fri Jun 05 23:52:48 PDT 2009,NO_QUERY,X3SarahP,RIP Grandpa  Will miss you.
0,2052171947,Fri Jun 05 23:52:51 PDT 2009,NO_QUERY,goofybella,Home for the night and glad to have tomorrow off... I will miss my eye candy though 
0,2052173549,Fri Jun 05 23:53:09 PDT 2009,NO_QUERY,javadimon,"Сижу в цеху, на MTS G3 модеме, ?коро?ть 1Mb!!! Wow! ? ведь ?то в четыре раза лучше, чем дома.... "
0,2052173683,Fri Jun 05 23:53:11 PDT 2009,NO_QUERY,xvikki,I always wake up early on a Saturday it's rubbishhhh 
0,2052173692,Fri Jun 05 23:53:11 PDT 2009,NO_QUERY,BellyTimberPDX,At @Nostrana having drinks with old friends. Got here too late for HH pizza  Next time...
0,2052173820,Fri Jun 05 23:53:12 PDT 2009,NO_QUERY,VickyBowyer,@GLWood25 I know! Breaks my heart to watch that now 
0,2052173823,Fri Jun 05 23:53:12 PDT 2009,NO_QUERY,miszadotcoren,@br00klynbetty i was up talkn to my friend abt my lifes plan &amp; decided going back to bmore is not lookn 2 promising 
0,2052173884,Fri Jun 05 23:53:13 PDT 2009,NO_QUERY,M3lizza, I seem to have lost 2 followers today! Should I take that personally am I really that boring???
0,2052174069,Fri Jun 05 23:53:15 PDT 2009,NO_QUERY,allenjaelee,@Jon_Favreau Can I have an internship? Please? 
0,2052174077,Fri Jun 05 23:53:15 PDT 2009,NO_QUERY,ann_harris,"@kauaiianSun I just went alum, too  Best wishes! @Steph_Mitchell  Representin' in Louisiana!"
0,2052174118,Fri Jun 05 23:53:15 PDT 2009,NO_QUERY,Karimx,@DaloDasha ehh dalia darling i see ur on twitter and not following me i m hurt  whats uppp man?? am i geting my wake up msg tmw i got work
0,2052174119,Fri Jun 05 23:53:15 PDT 2009,NO_QUERY,SarahMorrison,HOW AM I STILL 2 1/2 HRS AWAY FROM LA (fake crying) 
0,2052174518,Fri Jun 05 23:53:20 PDT 2009,NO_QUERY,jess_cahhh,Im craving hashbrowns  Boo to having a stupid eating schedule.
0,2052174538,Fri Jun 05 23:53:20 PDT 2009,NO_QUERY,SallyAnne64,i have a workout to do before we leave  its not doing my back much good
0,2052175073,Fri Jun 05 23:53:26 PDT 2009,NO_QUERY,venusflesh,The pilot light on the right side of our gas oven is off... I don't smell any gas though. WTF do I do?? Do I re-light it?! HELP 
0,2052175347,Fri Jun 05 23:53:30 PDT 2009,NO_QUERY,JayBaby31,@OnlYdeShanda awwwww 
0,2052175374,Fri Jun 05 23:53:30 PDT 2009,NO_QUERY,JessicaLomboy,is feeling insecure 
0,2052175435,Fri Jun 05 23:53:30 PDT 2009,NO_QUERY,candiedcharcoal,"Just packed the best friend of to the Graduate Fashion Week in London...exhausted from yesterday, and I have my work induction in an hour "
0,2052175893,Fri Jun 05 23:53:35 PDT 2009,NO_QUERY,fluffs76,"Mornin' all, miserable day.. off to work "
0,2052176166,Fri Jun 05 23:53:38 PDT 2009,NO_QUERY,HonestKelly,sad i had a link for my sunglasses but its to long  they r vintage aviators that r HOT PINK at target... fyi!
0,2052176366,Fri Jun 05 23:53:40 PDT 2009,NO_QUERY,TerribleTrend,Bed time. work tomorrow  night
0,2052176804,Fri Jun 05 23:53:46 PDT 2009,NO_QUERY,itsayleen,at a lost for words......feeling empty......  
0,2052176945,Fri Jun 05 23:53:47 PDT 2009,NO_QUERY,AshleyBrookes,Super tired with a tummy ache  ...I want to go to a Yankee game
0,2052177412,Fri Jun 05 23:53:53 PDT 2009,NO_QUERY,insertsmiley,@exialla i was on and then i had to get off cos twitter was down 
0,2052177564,Fri Jun 05 23:53:54 PDT 2009,NO_QUERY,loscabos2,@ashleytisdale Im sorry to hear about the album leaking  But at least acting out and overrated didnt leak ^.^
0,2052179697,Fri Jun 05 23:54:18 PDT 2009,NO_QUERY,gumsticker,Playing around with the netbook. I gotta get used to these tiny keys 
0,2052179730,Fri Jun 05 23:54:19 PDT 2009,NO_QUERY,katlilytwit,"@Orchidflower kind of a late bedtime, almost midnight and I'm on my couch. I got your name wrong today in #ff "
0,2052179766,Fri Jun 05 23:54:19 PDT 2009,NO_QUERY,Shirke,Goodmorning twitties! Wishing you all a great day! Hope mine will to.....if that migraine will go....BAGGAAA! 
0,2052179863,Fri Jun 05 23:54:20 PDT 2009,NO_QUERY,iamashlee,@sirvictoraguiar crappy tire...again. 
0,2052180072,Fri Jun 05 23:54:22 PDT 2009,NO_QUERY,amyn_8T,Oww!! I was so scared that i ran up the stairs to our house and i scraped the side of my thigh...now im bleeding 
0,2052180246,Fri Jun 05 23:54:24 PDT 2009,NO_QUERY,wardahannadiah,"@NMumz @aMyXXXI ahem. how i wish i'm smarter than you guys, MATHS-WISE! "
0,2052180331,Fri Jun 05 23:54:25 PDT 2009,NO_QUERY,onallus,@lisifreak so @kristenstewart9  is not anymore kristen stewart and rob's was hacked too..  just dunno why people need to hack accounts 
0,2052180674,Fri Jun 05 23:54:29 PDT 2009,NO_QUERY,lvbosworth,Waiting for everyone to eat breakfast!! (cough cough Brenden) colloseum abd roman forum this morning then FLORENCE! bye Rome 
0,2052181155,Fri Jun 05 23:54:34 PDT 2009,NO_QUERY,michaelggata,"@jessVARNISH true blood is soo good, can't wait for the second season to be mine! I hear a rumor that one of my favorite characters dies "
0,2052181323,Fri Jun 05 23:54:36 PDT 2009,NO_QUERY,h0wardajohnson,Jeheeez Jst Ate a Whole Packet Of Oreo;s.  Needa Drinkk Now Lol.
0,2052181658,Fri Jun 05 23:54:40 PDT 2009,NO_QUERY,DramaticMakeup,Borreeeddd.. 
0,2052181771,Fri Jun 05 23:54:41 PDT 2009,NO_QUERY,JenniferRene87,I guess they dont need me n e more. Thats such a horrible feeln. 
0,2052181878,Fri Jun 05 23:54:43 PDT 2009,NO_QUERY,laxmike,"According to several sources Rajeev Motwani seems to have suddenly passed away  , does anyone have more information?"
0,2052182077,Fri Jun 05 23:54:45 PDT 2009,NO_QUERY,CaliforniaKK,So tired but cant go to sleep. . . . . . .  
0,2052182094,Fri Jun 05 23:54:45 PDT 2009,NO_QUERY,Sid_Henrie,"@RoseWeasley Hey, Rose. I'm here, but I don't really feel like twittering much anymore  Lily's gone and you're not on much...sigh.."
0,2052182175,Fri Jun 05 23:54:46 PDT 2009,NO_QUERY,MelFresh27,Little Mel not so good!! 
0,2052182613,Fri Jun 05 23:54:51 PDT 2009,NO_QUERY,Stardragonca,@catawu Ghod forbid he should feel responsible for anything! 
0,2052182731,Fri Jun 05 23:54:52 PDT 2009,NO_QUERY,HonestlyShelby,i hate the itunes store. i've been trying to download the same movie for 2 days.... i'm getting very frustrated...very very frustreated 
0,2052182805,Fri Jun 05 23:54:53 PDT 2009,NO_QUERY,lizthorpetracey,bit ruff after discovering espresso martinis @thehospitalclub. but soldiering on to WECH board awayday on the barge. floating might help? 
0,2052182813,Fri Jun 05 23:54:53 PDT 2009,NO_QUERY,MiDesfileNegro,"@Rachecullen It sucks, doesn't it "
0,2052183334,Fri Jun 05 23:54:59 PDT 2009,NO_QUERY,nikstkd,i hope i'm doing the right thing here.. 
0,2052184658,Fri Jun 05 23:55:13 PDT 2009,NO_QUERY,Pauluk1983,the summer is here!!!...*runs to window*...oh 
0,2052184747,Fri Jun 05 23:55:14 PDT 2009,NO_QUERY,omahaprogrammer,I'm thinking I should get another one... But I have to be awake by 6! 
0,2052185034,Fri Jun 05 23:55:17 PDT 2009,NO_QUERY,One_More_Girl,Going to pass out to some Chelsea Lately. I feel gross  - C
0,2052185095,Fri Jun 05 23:55:18 PDT 2009,NO_QUERY,ZoDogg34,How sad 29 kids die in Mex. day care fire  http://bit.ly/tv7hy
0,2052185122,Fri Jun 05 23:55:18 PDT 2009,NO_QUERY,tonimaechase,is very sad  ...
0,2052185148,Fri Jun 05 23:55:18 PDT 2009,NO_QUERY,NaNa_Arbena,L-O-N-G day tomorrow. no time for twitter. 
0,2052185338,Fri Jun 05 23:55:21 PDT 2009,NO_QUERY,AmandaWeedmark,ah man...one thing I forgot to backup...my web bookmarks  *sniff*
0,2052185763,Fri Jun 05 23:55:25 PDT 2009,NO_QUERY,lvbosworth,@NRMcclelland miss u lots  u should be here with me and Brenden!!! It's like I'm missing a sibling!!!
0,2052185833,Fri Jun 05 23:55:26 PDT 2009,NO_QUERY,Joshua_Salinas,Dude this movie is trippin me out! Hate being home alone!  I'm all looking out my windows and shit! Lol
0,2052185952,Fri Jun 05 23:55:27 PDT 2009,NO_QUERY,tanastalin,Sleeping on the beach with the sound of crashing waves...and the train tracks 
0,2052185965,Fri Jun 05 23:55:27 PDT 2009,NO_QUERY,Jase88,I guess i should get ready for work.  I REALLY dont want to go.  *cries*
0,2052186130,Fri Jun 05 23:55:29 PDT 2009,NO_QUERY,SarahMessee,I wanna sleep in tomorrow but I can't 
0,2052186143,Fri Jun 05 23:55:29 PDT 2009,NO_QUERY,DracoTrainer,Got the BrainBone daily question wrong!  - http://bit.ly/13fSrY
0,2052186218,Fri Jun 05 23:55:30 PDT 2009,NO_QUERY,whatcanbrwndo4u,damn insomnia ... I want to sleeeep 
0,2052186374,Fri Jun 05 23:55:32 PDT 2009,NO_QUERY,CharmedJenn,@1capplegate I really hope another network picks up Samantha Who? - I love that show!  They always cancel the great shows.  
0,2052186499,Fri Jun 05 23:55:33 PDT 2009,NO_QUERY,itsmestacy,@Serendipity75 ((hugs)) I'm so sorry 
0,2052187016,Fri Jun 05 23:55:39 PDT 2009,NO_QUERY,TWUC_Tara,Headache hardcore 
0,2052187143,Fri Jun 05 23:55:40 PDT 2009,NO_QUERY,thattamaragirl,Stupid ipod. Stupid stupid ipod. I freaking love you. Why must you deceive me now? 
0,2052187303,Fri Jun 05 23:55:43 PDT 2009,NO_QUERY,LO2o,oh and I have a headache with no panadol  and its my birthday
0,2052187374,Fri Jun 05 23:55:43 PDT 2009,NO_QUERY,SoStylishJ,Hope these damn Air Yezzy's are worth it!! I'm dying in this car. 
0,2052187482,Fri Jun 05 23:55:45 PDT 2009,NO_QUERY,dellaanggiani,@princess_wnda : what's wrong with the new guy darl? :p and yeaah i miss you too.NO DOUBT. can't wait to come back home SOON 
0,2052188133,Fri Jun 05 23:55:53 PDT 2009,NO_QUERY,whirlygig77,"freezing cold, windy and &quot;that rain that gets you wet&quot; - Yep, it's a work day!!! "
