0,1879920843,Thu May 21 23:32:16 PDT 2009,NO_QUERY,kellz_bells,so tired and doesnt want 2 now go 2 work afta a day of teaching 
0,1879921488,Thu May 21 23:32:23 PDT 2009,NO_QUERY,ckortekaas,Kinda got Solr  CD replication working... and now my brain is hurty.  Looks like I can only sync  every 5 mins.. so in prod its out 5  wt?
0,1879921620,Thu May 21 23:32:25 PDT 2009,NO_QUERY,wowlew,isPlayer Has Died! Sorry 
0,1879921657,Thu May 21 23:32:25 PDT 2009,NO_QUERY,dperschonok,"@aegies Agreed, I was so bummed when it got canceled "
0,1879921732,Thu May 21 23:32:26 PDT 2009,NO_QUERY,Kaay,keep scratching bites on my legs  i don't want any more scars though 
0,1879922031,Thu May 21 23:32:29 PDT 2009,NO_QUERY,Adriennemaree,totally on the dark side right now. all my mail just vanished from my mail program.  BOO.
0,1879922319,Thu May 21 23:32:32 PDT 2009,NO_QUERY,holyschmoke,@GoTheWallabies Rocky'll be missed here we don't want him to leave  #rugby #Leinster
0,1879922412,Thu May 21 23:32:33 PDT 2009,NO_QUERY,oxemily,Off to work. Waay to early 
0,1879922596,Thu May 21 23:32:35 PDT 2009,NO_QUERY,AmandaaPants,soooo sean . attempted to take photo of just me :] but failed cos my cameras dead 
0,1879922933,Thu May 21 23:32:39 PDT 2009,NO_QUERY,thngwhtsqks,"@mmalkoff we will miss you  glad I got to see you, wish I'd had a good question for ya :-p"
0,1879923119,Thu May 21 23:32:41 PDT 2009,NO_QUERY,GadgetVirtuoso,"@JenWojcik the media seems to think the worst is behind us, so they imply. I think we haven't seen the worst of it yet. "
0,1879923368,Thu May 21 23:32:43 PDT 2009,NO_QUERY,claire_diallo,Up early having lemsip ..!  hope I'm feeling better for beyonce later
0,1879923431,Thu May 21 23:32:44 PDT 2009,NO_QUERY,JerseyJul,"@ashleyobvs he plays this game,i dunno the name, but i we kept playing til all our money was in waps pile  bitch lost like 15 bucks to him"
0,1879923763,Thu May 21 23:32:48 PDT 2009,NO_QUERY,Mycide,It's difficult to go to a decision in griffin vs bonnar classic fight.  I keep knocking him out 
0,1879924067,Thu May 21 23:32:51 PDT 2009,NO_QUERY,Trish_B, #SaveEarl
0,1879924405,Thu May 21 23:32:55 PDT 2009,NO_QUERY,ohsosteph,starting to get sick? oh nooo 
0,1879924518,Thu May 21 23:32:56 PDT 2009,NO_QUERY,DiyanaRazinah,@f_nadzirah too much people ada twitter sudah! it's getting overrated! 
0,1879925490,Thu May 21 23:33:07 PDT 2009,NO_QUERY,kimcess,"@jenns29 get well jenn, I totally know what it feels like "
0,1879925545,Thu May 21 23:33:08 PDT 2009,NO_QUERY,NicoleReitmeier,Work soon 
0,1879925845,Thu May 21 23:33:11 PDT 2009,NO_QUERY,Staceyleighx,just got home from the hospital... my grandma was admitted. 
0,1879925879,Thu May 21 23:33:12 PDT 2009,NO_QUERY,dyanyanyan,I just watched the Lakers but they lost 
0,1879925924,Thu May 21 23:33:12 PDT 2009,NO_QUERY,bubu_,"i still need you, i still care about you, i still feel you like i'm right beside you...and i still love you "
0,1879926052,Thu May 21 23:33:13 PDT 2009,NO_QUERY,babbyb23,i'm gonna cry  here comes the pain 
0,1879926299,Thu May 21 23:33:16 PDT 2009,NO_QUERY,LukeLawrie,@bjds my WRX doesnt go sideways in the rain like my Skyline does 
0,1879926351,Thu May 21 23:33:17 PDT 2009,NO_QUERY,Nanetje,Don't want to wake-up. I will end up having a SPSS nightmare again 
0,1879926682,Thu May 21 23:33:20 PDT 2009,NO_QUERY,dunk,@benhendry quite a while i'm afraid 
0,1879926706,Thu May 21 23:33:20 PDT 2009,NO_QUERY,lovejonas_x,I dont think the Jb movie is coming to my cinema 
0,1879927058,Thu May 21 23:33:24 PDT 2009,NO_QUERY,lushlady15,"@hannahmei i don't know whether this is going to work or not  bloody shaped internet! if it doesn't, I will still upload it, &amp; just wont"
0,1879927168,Thu May 21 23:33:25 PDT 2009,NO_QUERY,NalGang,It was a great American Idol Finale...Pity Adam didn't win though 
0,1879927203,Thu May 21 23:33:25 PDT 2009,NO_QUERY,iiamShe,@Mama_Gedlu haha better not be! but when is yours..? i cant go to ours..im gonna be out of town  it sucks!! but did u get ur dress?
0,1879927212,Thu May 21 23:33:25 PDT 2009,NO_QUERY,GTPeach,"@prozac420 I agree, but it isn't adium doing it. It's blip.fm and I can't seem to turn it off. "
0,1879927309,Thu May 21 23:33:26 PDT 2009,NO_QUERY,uhoh_lindsey,@mattownsyoface well your day has to be better then mine. i fell down my stairs in the backyard and it hurts 
0,1879927352,Thu May 21 23:33:27 PDT 2009,NO_QUERY,Krysnix,@lauren_kit hmmm I'll be gone by then 
0,1879927512,Thu May 21 23:33:29 PDT 2009,NO_QUERY,ashhh_x,I am soo tired. And Sick! 
0,1879927541,Thu May 21 23:33:29 PDT 2009,NO_QUERY,babbyb23,awww charms i'm gonna miss you 
0,1879927625,Thu May 21 23:33:30 PDT 2009,NO_QUERY,TheLimousines,@KWOD - so sad you guys are going away. 
0,1879928016,Thu May 21 23:33:34 PDT 2009,NO_QUERY,JBeauty,@MissSuccess I cant find anything KITA WHAT AM I GONNA DO 
0,1879928551,Thu May 21 23:33:40 PDT 2009,NO_QUERY,turoczy,@znmeb Will do. I have got to see him speak someday. Keep getting booked at the same time or just plain missing his sessions 
0,1879928650,Thu May 21 23:33:41 PDT 2009,NO_QUERY,haushinkaitlyn,"@nightwellspent it'll be on the comedy central website for sure. IT'S OKAY, but you should still try to get on aim for a little bit. "
0,1879929594,Thu May 21 23:33:52 PDT 2009,NO_QUERY,aidanogle,hates being away 
0,1879930056,Thu May 21 23:33:57 PDT 2009,NO_QUERY,baby8589,Awsome night too bad it had to end 
0,1879930116,Thu May 21 23:33:57 PDT 2009,NO_QUERY,Brianna_1120,@DanielleyElley What have you started me on? I've been on this damn site all night. And Ihave an early deadline tomorrow 
0,1879930192,Thu May 21 23:33:58 PDT 2009,NO_QUERY,camilamoreno,jason mraz anoop and now an alex with him too? It's all about the love for a child... right?  sad stories all day...
0,1879930557,Thu May 21 23:34:02 PDT 2009,NO_QUERY,LNott7,Just woke up after a bad nights sleep  to my 14yr old reciting word 4 word what happened in The Inbetweeners last night ho hum wf lol...
0,1879930716,Thu May 21 23:34:04 PDT 2009,NO_QUERY,jayejaye,@Kerryn  sorry to hear that dude
0,1879931000,Thu May 21 23:34:07 PDT 2009,NO_QUERY,babbyb23,she's such a good friend and she leaving  i'll be crying at school tomorrow 
0,1879931046,Thu May 21 23:34:07 PDT 2009,NO_QUERY,tomsommer,"Watched &quot;The International&quot;, what a letdown "
0,1879931080,Thu May 21 23:34:08 PDT 2009,NO_QUERY,amyiscool,this is not fair. All the schools round herd are off today.. Except ours  goodbye year 11s
0,1879931162,Thu May 21 23:34:09 PDT 2009,NO_QUERY,Uraelia,"Um.....Twittering? Right? My first time on here. But also, I can't sleep like usual "
0,1879931177,Thu May 21 23:34:09 PDT 2009,NO_QUERY,vaginasaurus,@LilithHecate it's supposed to be in the high 60s here  But I will not be discouraged!
0,1879931286,Thu May 21 23:34:10 PDT 2009,NO_QUERY,einahpets20,home is really boring. im home by my self. tash is at work. cass is at work. daniel at the gym and mum and dad are getting coffee. bleh 
0,1879931846,Thu May 21 23:34:17 PDT 2009,NO_QUERY,Squarlotte,@tommcfly I know how you feel I was a loner yesterday because my 3 best friends have left me! 
0,1879932050,Thu May 21 23:34:19 PDT 2009,NO_QUERY,danalolz,I'm getting your emails... you ain't getting mine 
0,1879932102,Thu May 21 23:34:20 PDT 2009,NO_QUERY,gerrymoth,"Morning everyone, god do i feel rough this morning  Curry and me don't get on"
0,1879932268,Thu May 21 23:34:22 PDT 2009,NO_QUERY,lost_dog,@AndyRattinger I am lost. Please help me find a good home. 
0,1879932398,Thu May 21 23:34:23 PDT 2009,NO_QUERY,lockerhaxor,TF2 has updated but its way to late to play.  looks like I'll be spying and sniping my heart out tomorrow 
0,1879932447,Thu May 21 23:34:24 PDT 2009,NO_QUERY,waaaida,i have to go soooooooon. science science science. 
0,1879932638,Thu May 21 23:34:26 PDT 2009,NO_QUERY,sTeP_eNd,is preparing himself before going back to his own place.. 
0,1879932777,Thu May 21 23:34:28 PDT 2009,NO_QUERY,shigginski,Kingsford Smith Dr is a crawl - so much for early Friday  #bnetraffic
0,1879932963,Thu May 21 23:34:30 PDT 2009,NO_QUERY,lshenry7,Gah! I'm almost 20  I feel old when i see little kids walking and talking. I remember a time before they were born!
0,1879933221,Thu May 21 23:34:33 PDT 2009,NO_QUERY,genevievedargis,@carrieballz noo i am too! just cause you talked about it ahaha 
0,1879933341,Thu May 21 23:34:35 PDT 2009,NO_QUERY,EJCutliff,@MikeSnedegar Ok TAO had two shot outs in this song +10 but the song is no bueno -20  http://bit.ly/r9aM0
0,1879933377,Thu May 21 23:34:35 PDT 2009,NO_QUERY,ShellsAngels,I finished the main story in Fable2 and I don't know what to to with myself other than I need to find a way to get my dog back 
0,1879934029,Thu May 21 23:34:42 PDT 2009,NO_QUERY,rosevega,I just broke my nail. Intensely. 
0,1879934031,Thu May 21 23:34:42 PDT 2009,NO_QUERY,wowlew,isPlayer Has Died! Sorry 
0,1879934207,Thu May 21 23:34:44 PDT 2009,NO_QUERY,TKfan27,"@zeet75 No, no eyeshadow pallet. They usually don't give me presents until my birthday party but they're broke so....  I NEED THAT PALLET!"
0,1879935046,Thu May 21 23:34:54 PDT 2009,NO_QUERY,HonourGuard,Problem with living at home in the suburbs: it is difficult to get to a bed after excessive imbibing happens and trains stop running 
0,1879935110,Thu May 21 23:34:54 PDT 2009,NO_QUERY,jmarr0688,Watching raven wanting to give @jherr1390 a hug 
0,1879935174,Thu May 21 23:34:55 PDT 2009,NO_QUERY,lisaxjbx3,@daniellemhicks I know. such a cutie even when crying.  
0,1879935214,Thu May 21 23:34:55 PDT 2009,NO_QUERY,sarahhcyanide,@DillTurnips: who is pissin you off dude? 
0,1879935807,Thu May 21 23:35:02 PDT 2009,NO_QUERY,aven182,is bummed his cash strapped situation has forced him to be grounded and not in brak 
0,1879935891,Thu May 21 23:35:03 PDT 2009,NO_QUERY,CarlinVoho,Loved Chelsea flower show - 1st ever visit.  Now my garden seems tiny! Why won't my jasmine flower?? 
0,1879936009,Thu May 21 23:35:04 PDT 2009,NO_QUERY,sheridanchoi,had to cancel @antidances  stupid cml got in the way. but meeting tomorrow!!! 
0,1879936123,Thu May 21 23:35:07 PDT 2009,NO_QUERY,ACTS,http://twitpic.com/5ofqm - Justin getting ready for the last time.. 
0,1879936415,Thu May 21 23:35:08 PDT 2009,NO_QUERY,rachellawson89,"@mitch_41 you're welcome! Urgh this feels way too early to be up after my 2 days off  yes yes yes, mega house warming party please!"
0,1879936432,Thu May 21 23:35:08 PDT 2009,NO_QUERY,chrisridd,Will have to instigate the &quot;disable account&quot; procedure later today 
0,1879936779,Thu May 21 23:35:11 PDT 2009,NO_QUERY,PuckLuLu,@Cort428 i wish i was married too  we are both losers lol
0,1879936920,Thu May 21 23:35:13 PDT 2009,NO_QUERY,Bunknee,"My son is such a breakfast moocher, no matter what he gets mine always looks better. Unfortunately this doesn't work with vegetables. "
0,1879937276,Thu May 21 23:35:17 PDT 2009,NO_QUERY,eldawghomegirl,there should be rule that my boyfriend should have to answer his phone during all hours of the night. i'm lonely! 
0,1879937685,Thu May 21 23:35:21 PDT 2009,NO_QUERY,jenforce,Is in misery. It's too hot to sleep and the pollen is killing me. But I can't shut the window because it's too hot 
0,1879937747,Thu May 21 23:35:22 PDT 2009,NO_QUERY,Fletcher_Ox,@tommcfly Bummer you have to wait a year  Think on the plus side. You get to see him for one lasttime before he retiries  Be amazing xxx
0,1879937890,Thu May 21 23:35:24 PDT 2009,NO_QUERY,unequalized,@supmanda http://www.kwod.net/index.php this is why 
0,1879938190,Thu May 21 23:35:27 PDT 2009,NO_QUERY,Hildy77,Good morning! Woke up completely exhausted 5th morning in a row after a solid nightmare.noo idea why but its really bleh 
0,1879938228,Thu May 21 23:35:27 PDT 2009,NO_QUERY,ShainaW,10 confirmed cases of Swine Flu in Australia. 15 year old Adeliade girl tested positive. Im soooo scared 
0,1879938335,Thu May 21 23:35:28 PDT 2009,NO_QUERY,FORBIDDEN26,Ok so how about I got into an accident on my way to the club 
0,1879938735,Thu May 21 23:35:33 PDT 2009,NO_QUERY,jLyNeTtE,"fuck, dis months cell phone bill ain't no joke "
0,1879939768,Thu May 21 23:35:45 PDT 2009,NO_QUERY,DicesIces,"@jojoconcierge wow U showed up 2nite?! U should have been a fly, Bruce, his kids &amp; ur kids deserve much better! do the right thing.... "
0,1879940015,Thu May 21 23:35:48 PDT 2009,NO_QUERY,davetownsendme,We been invited to captains party tonight. Got to wear a tux however  what a parlavour
0,1879940338,Thu May 21 23:35:52 PDT 2009,NO_QUERY,Loribot,Totally up for the some Violent Femmes only I cannot find my cd. 
0,1879940560,Thu May 21 23:35:55 PDT 2009,NO_QUERY,elysah87,"@SarahKSilverman Aw... I think the same things. I try to talk to them if they're alone  Okay, goodnight tweetiepies! Mwah!"
0,1879940671,Thu May 21 23:35:56 PDT 2009,NO_QUERY,AvaCScott,is sad  Poor Adam! Really hoped he would win Idol!
0,1879940966,Thu May 21 23:35:59 PDT 2009,NO_QUERY,winniemzembe,"my mother has a cold, lets hope i dnt get it  ahaha watching jerry springer! ;) JERRY, JERRY JERRY!!!!"
0,1879941003,Thu May 21 23:36:00 PDT 2009,NO_QUERY,007peter,"@NaniWaialeale No, not Keith Olbermann, he annoy me   Anyhow, I'm hitting the hey. We will continue our tweat tmrw.  Sweet Dream "
0,1879941055,Thu May 21 23:36:00 PDT 2009,NO_QUERY,misskris91,"heyy,just went shopping, so over it now and i cant even drive becuase dads banned me from my car so he drove it and i cant drive his "
0,1879941086,Thu May 21 23:36:01 PDT 2009,NO_QUERY,vilinh,I can't sleep  WHY!!!!!
0,1879941337,Thu May 21 23:36:03 PDT 2009,NO_QUERY,officialnathan,@AshleyLTMSYF @pcdmelodyt @KimberlyDoll @JessicaPinup How come you didn't perform with back-up dancers in New Zealand? 
0,1879941680,Thu May 21 23:36:07 PDT 2009,NO_QUERY,Feefee3,just got back from buying a new phone and i get a call to say that some people found Shane's phone... $300 wasted! 
0,1879941894,Thu May 21 23:36:09 PDT 2009,NO_QUERY,theseheadlines,"whyyyy am i still up. it's 2:30. and i'm still writing an english paper. i think i'll just sleep in every class tomorrow, yah? "
0,1879941979,Thu May 21 23:36:10 PDT 2009,NO_QUERY,cyberiagirl,can't believe she had such a frustrating work conversation so close to going home time. It will spoil the whole weekend! 
0,1879942348,Thu May 21 23:36:14 PDT 2009,NO_QUERY,VoyeurPhoto,@cbowi3 I can't..................  Some people get that man pouch with age.
0,1879942404,Thu May 21 23:36:15 PDT 2009,NO_QUERY,girljordyn,@koriannespeaks Haha yes. Sorry.  Next time i will get more people to play.
0,1879942718,Thu May 21 23:36:18 PDT 2009,NO_QUERY,niboswald,"@alliecobra Would love to go, but Godzilla that night.  What time does it start/end? City revelry afterwards perchance?"
0,1879942907,Thu May 21 23:36:20 PDT 2009,NO_QUERY,perfectdenial,i wish i had some cash. i want to go to vinyl tomorrow night for drinks.  Maybe dad will gift me. @daniellefaithe where you at?
0,1879943161,Thu May 21 23:36:23 PDT 2009,NO_QUERY,ninerfan1981,no you don't i don't help you out sorry honey.... 
0,1879943563,Thu May 21 23:36:27 PDT 2009,NO_QUERY,JaymieP,the new Taking Back Sunday record is a bit of let-down  Still some decent songs on it though
0,1879943628,Thu May 21 23:36:28 PDT 2009,NO_QUERY,MissRobertson27,TeXTiN THe CuPCaKe. uPSeT THaT He WeNT ouT To THe CLuB  He GoT SuM eXPLaiNiN To Do!!! SQuaRe BiDNeSS... LoL
0,1879943896,Thu May 21 23:36:31 PDT 2009,NO_QUERY,beestarr,@LisaLavie girl that tooth is a killer mine been tryna come out for years and it gets me sick everytime it trys 
0,1879943922,Thu May 21 23:36:32 PDT 2009,NO_QUERY,IsisSoSnewty,  shakes head
0,1879944275,Thu May 21 23:36:36 PDT 2009,NO_QUERY,shazzt,Beautiful sunshine in Paihia this morning. Rain in Auckland tonight. Holiday over 
0,1879944477,Thu May 21 23:36:38 PDT 2009,NO_QUERY,patchh,@mongab I DON'T WANT HIM TO GO EITHERRR. ((( It's so depressinggg... He's booked &amp; everythinggg.  I think he's leaving September 3.
0,1879944741,Thu May 21 23:36:41 PDT 2009,NO_QUERY,ncfcog,@lenamac You too...off to London 
0,1879944860,Thu May 21 23:36:42 PDT 2009,NO_QUERY,joeyguerra,"Just home from a terrific @prideidol - and we said goodbye to cute, cuddly chris plata, our youngest contestant. always sad. "
0,1879944964,Thu May 21 23:36:43 PDT 2009,NO_QUERY,StockmanGirl,@praguematic Nooooooooo  but it is down that block. I had to park down the st and walk home. Awesome safety officer :/
0,1879945151,Thu May 21 23:36:45 PDT 2009,NO_QUERY,Serahtu,"Went to dentist yesterday, got teeth cleaned. Now one of my teeth won't stop hurting, needs a root canal done on it. "
0,1879945489,Thu May 21 23:36:49 PDT 2009,NO_QUERY,clag_on_toast,Lunch rush is over no more nice bums to perve on  ohp there's one.....
0,1879945571,Thu May 21 23:36:50 PDT 2009,NO_QUERY,TheRedEyedJedi,"Home, passin' out. Being abused be my friend. Owww! (She's mean!) "
0,1879945772,Thu May 21 23:36:52 PDT 2009,NO_QUERY,komits,@jaimeeashley i love your neotokyo stone too i baught every different energy drink they have i got 2 free but they all tasted the same 
0,1879945775,Thu May 21 23:36:52 PDT 2009,NO_QUERY,rosshill,Are #SBdrinks happening in Melb anymore? @ppeach is out of town so I haven't heard of anything 
0,1879946370,Thu May 21 23:36:59 PDT 2009,NO_QUERY,dj_melza,"i have a headache  and i have youth 2nite, ohh nooo i dont want to be down in the dumps 4 youth =["
0,1879946912,Thu May 21 23:37:05 PDT 2009,NO_QUERY,hello_paradox,@sodapopcurtis  sorry to hear that.
0,1879947091,Thu May 21 23:37:07 PDT 2009,NO_QUERY,angeliqueisrael,@itschantalelise it's very sad to watch other people do what you love 
0,1879947254,Thu May 21 23:37:09 PDT 2009,NO_QUERY,Rachcurrie,am at work all alone  cranking sounds
0,1879947542,Thu May 21 23:37:12 PDT 2009,NO_QUERY,chakramchucker,my room feels so empty and cold 
0,1879947781,Thu May 21 23:37:15 PDT 2009,NO_QUERY,amfaria8524,ready for bed..this vacation is close to bein over 3 more days 
0,1879947822,Thu May 21 23:37:15 PDT 2009,NO_QUERY,TheMacMommy,@Hip_M0M technically they told her she miscarried since she was only 20wks gest.  she did get to hold her though. they're looking into it.
0,1879947991,Thu May 21 23:37:17 PDT 2009,NO_QUERY,Mockheroic,... Tried really hard to stay and socialize but I'm sort of a hermit lately ... 
0,1879948207,Thu May 21 23:37:20 PDT 2009,NO_QUERY,spacesharkk,Upload didn't solve my problems #sonysucks so back to the drawing board to start from square one in the morning. 
0,1879948759,Thu May 21 23:37:26 PDT 2009,NO_QUERY,KatzyRigaud,does anybody know where &quot;4eva gutta&quot; gets the hair for her ads? she wont tell  halp pwese!
0,1879948879,Thu May 21 23:37:28 PDT 2009,NO_QUERY,beccarr_mcc,German today... Lies. 
0,1879949015,Thu May 21 23:37:30 PDT 2009,NO_QUERY,ellaxceleste,@bittersw33tlove ive been kissing my teeth on purpose to listen to them say steup but it never happens 
0,1879949128,Thu May 21 23:37:31 PDT 2009,NO_QUERY,ChelseaTavares,@poogy hahha. i know. my ma dnt love me. 
0,1879949440,Thu May 21 23:37:34 PDT 2009,NO_QUERY,ThePatient94,@Triptophobia ICUTHAR! Thanks for the email. You said you'd be online?  I'm boored. and I need ideas for an OC. My art is flatline ATM.
0,1879949545,Thu May 21 23:37:36 PDT 2009,NO_QUERY,BaloonKnot,im on the episode of scrubs where jordans brother dies 
0,1879949672,Thu May 21 23:37:37 PDT 2009,NO_QUERY,ngpedro,At airport in Beijing...Vancouver awaits...  but the damn Lakers lost 
0,1879949809,Thu May 21 23:37:39 PDT 2009,NO_QUERY,FadingSpark,http://bit.ly/lrChg   i've missed this song. 
0,1879949811,Thu May 21 23:37:41 PDT 2009,NO_QUERY,lawrencedenes,"@eveholt I feel for you, i HATE those things "
0,1879949863,Thu May 21 23:37:39 PDT 2009,NO_QUERY,nurainiffah, EXAMS SUCK!!!!!!!!!!
0,1879949962,Thu May 21 23:37:40 PDT 2009,NO_QUERY,brittanyoliver,@ALLIEINCREDIBLE call my fone asap cuz sumbody cakin hard on my shit rite now 
0,1879950012,Thu May 21 23:37:41 PDT 2009,NO_QUERY,primrosegrace,y did i do this to myself? crushed numb stupid and hurt is not even close to how i feel F!@# you! 
0,1879950293,Thu May 21 23:37:44 PDT 2009,NO_QUERY,switzx,@ldygabilan I deal with that every other morning thanks to Ranza. I'm sorry. 
0,1879950831,Thu May 21 23:37:50 PDT 2009,NO_QUERY,bobbymarc,wtf.  thanks...
0,1879950842,Thu May 21 23:37:51 PDT 2009,NO_QUERY,coffeegeek,"@fiftypercent I was going to finish up my review of the Ascaso Duo, but apparently they changed it 2 months ago "
0,1879951052,Thu May 21 23:37:53 PDT 2009,NO_QUERY,NiamhSkinner,Hate these AM exams 
0,1879951274,Thu May 21 23:37:56 PDT 2009,NO_QUERY,moderntradition,I cannot deny it any longer.. I have the flu  but I'm at my mommy's house.. Sipping tea and curled up in the bed with the Mr.
0,1879951286,Thu May 21 23:37:56 PDT 2009,NO_QUERY,MillZz,@JillzWorth  lol @ Batman
0,1879951734,Thu May 21 23:38:01 PDT 2009,NO_QUERY,wowlew,isPlayer Has Died! Sorry 
0,1879952290,Thu May 21 23:38:07 PDT 2009,NO_QUERY,lintsu,I'm sad that #Without a trace will be canceled.  One of greatest tv series.
0,1879952365,Thu May 21 23:38:08 PDT 2009,NO_QUERY,mcraddictal,@AwesomeFrank i'm sorry to hear that  hate it when you feel bad.
0,1879952369,Thu May 21 23:38:08 PDT 2009,NO_QUERY,HollywoodLAVES,"Driving past 264647883736 ATMs, just so we can find the actual bank  I wanna be at Marathon/Mas Tequila!!!"
0,1879952403,Thu May 21 23:38:08 PDT 2009,NO_QUERY,james__buckley,How the hell am I gonna have a late one tonight when I've been up since 6 
0,1879952451,Thu May 21 23:38:09 PDT 2009,NO_QUERY,ranza,wow #revision3.com is one big ad 
0,1879952640,Thu May 21 23:38:11 PDT 2009,NO_QUERY,chuckli,@mrssneakerhead entertain my bordem...i cnt sleep 
0,1879952691,Thu May 21 23:38:11 PDT 2009,NO_QUERY,hunniebits,"Argh! Being sick sucks! My head hurts, my throat hurts, and i feel like throwing up "
0,1879952826,Thu May 21 23:38:13 PDT 2009,NO_QUERY,britmoorer,i cant believe &quot;the game&quot; is cancelled..it was just getting good 
0,1879952827,Thu May 21 23:38:13 PDT 2009,NO_QUERY,GoTheWallabies,@GoTheWallabies Rocky'll be missed here we don't want him to leave  #rugby #Leinster (via @holyschmoke) Really!!! Rocky is Cocky
0,1879952855,Thu May 21 23:38:13 PDT 2009,NO_QUERY,inwils,@Brooksyonair not got radio on now 
0,1879952895,Thu May 21 23:38:14 PDT 2009,NO_QUERY,kathrynbunghole,Green day or warped? I don't have moneys for both 
0,1879953024,Thu May 21 23:38:15 PDT 2009,NO_QUERY,ATCgod,"FML, first memorial day back in the states in god knows how long and im alone "
0,1879953071,Thu May 21 23:38:16 PDT 2009,NO_QUERY,darjoy62102,My poor sick baby can not breath through his nose 
0,1879954187,Thu May 21 23:38:28 PDT 2009,NO_QUERY,iSlayer2009,@jasonyates ello sweetiiiieee!!! I've not been on here a great deal this week I guess  I'm ok tho. How's you?! Hood week so far? Xxx
0,1879954435,Thu May 21 23:38:31 PDT 2009,NO_QUERY,Darenzia,@RiverClark oh shit isn't it poker night at your place tonite? I'm fighting zombiedeath  it lurks in thee shadowsssssss
0,1879954438,Thu May 21 23:38:34 PDT 2009,NO_QUERY,tbellxo,http://twitpic.com/5ofvt Leavin sOon  btw its FREEZIN here @ pendleton!
0,1879954624,Thu May 21 23:38:33 PDT 2009,NO_QUERY,christiinnaa,It really sucks when you realize some things. I'm done 
0,1879954941,Thu May 21 23:38:37 PDT 2009,NO_QUERY,BriAshley88,@TraceeEllisRoss found out Maya was cheating...that ending part was soo full of emotions!..i miss the show  Wat is in store for u!??
0,1879955321,Thu May 21 23:38:41 PDT 2009,NO_QUERY,TehStalker,just stepped on a sticker  ouch......at least  it didn't break and leave a splinter
0,1879955529,Thu May 21 23:38:44 PDT 2009,NO_QUERY,YasminForsythe,@andymark_ aw i want tea 
0,1879955560,Thu May 21 23:38:44 PDT 2009,NO_QUERY,greentea222,"Cnt sleep sinuses actin up, da common cold is takin effect  not pleased i say!!"
0,1879955608,Thu May 21 23:38:45 PDT 2009,NO_QUERY,utbrown,Not having a good marriage day.  
0,1879955638,Thu May 21 23:38:45 PDT 2009,NO_QUERY,Vosenbergen,@Bookstorebabe21 hahaha oh noes my multiple characters-ing freaks you outs! Noes! 
0,1879955786,Thu May 21 23:38:47 PDT 2009,NO_QUERY,navinmangalat,"I hate this city sometimes. No power last night. ALL night. *sigh* Am so tired, it hurts when I blink "
0,1879956047,Thu May 21 23:38:50 PDT 2009,NO_QUERY,SuffocatedSAfa,i just hate this day 
0,1879956104,Thu May 21 23:38:51 PDT 2009,NO_QUERY,PreetiSodhi,@lavilicious Dude! U guys bought a boat?!. OMG! Awesome man!.. Ahh.. Take me with u.. 
0,1879956198,Thu May 21 23:38:52 PDT 2009,NO_QUERY,srk_SaY13,umm French speaking/roleplay today  waa
0,1879956450,Thu May 21 23:38:55 PDT 2009,NO_QUERY,RegiBear,I would like to inform you all that my piece of shit phone has now been completely dismembered. leave me a tweet if you need me.  
0,1879956615,Thu May 21 23:38:57 PDT 2009,NO_QUERY,lovelymissaubry,Just finished the most bad ass swing dress.  If it were a size smaller I'd keep it.  
0,1879956757,Thu May 21 23:38:59 PDT 2009,NO_QUERY,haushinkaitlyn,@nightwellspent WHY DID YOU PUKE? 
0,1879956961,Thu May 21 23:39:01 PDT 2009,NO_QUERY,Terry_McFly,@Shadow8813  it cost me 20 dollars to get in that club so I was broke all over again 
0,1879957283,Thu May 21 23:39:04 PDT 2009,NO_QUERY,rebekahwilliams,"I had SO MUCH FUN tonight. I have the best, most entertaining and talented friends ever. I might miss Noller after all "
0,1879957318,Thu May 21 23:39:04 PDT 2009,NO_QUERY,JessRIOT,last day today 
0,1879957534,Thu May 21 23:39:07 PDT 2009,NO_QUERY,Keonismama,@SmellyMel82 yeyyy we got confused it was supposed to be the last Saturday of the month 
0,1879957922,Thu May 21 23:39:12 PDT 2009,NO_QUERY,iamapotatosack,Has begun counting the strands of her haid due to boredom.  )
0,1879958293,Thu May 21 23:39:16 PDT 2009,NO_QUERY,CherryFever2, i lost my 021 charger last night 
