0,1880030772,Thu May 21 23:53:04 PDT 2009,NO_QUERY,Aloemilk,@dreamer7231 what? what happened?hope you throwed up for fun reasons and not for illness  Good luck with the exam tomorrow!!!
0,1880030786,Thu May 21 23:53:04 PDT 2009,NO_QUERY,Snicz,@janni518  yes and I had to tell the story of what happened countless times *g*  today however i'm ABSOLUTELY shattered 
0,1880031201,Thu May 21 23:53:09 PDT 2009,NO_QUERY,Specialesumpen,"The thunder never came  Was up at 4 am, but there was nothing."
0,1880031223,Thu May 21 23:53:09 PDT 2009,NO_QUERY,coltschick1388,I need to stop being awake at 3 am! 
0,1880031249,Thu May 21 23:53:09 PDT 2009,NO_QUERY,GwenTheAnnoying,"my nose hurts....  typical, the day my step-mom decides that the velvet tissues are to expensive is the day I get sick!"
0,1880031257,Thu May 21 23:53:09 PDT 2009,NO_QUERY,420thoughts,@RoXyGurl very bummed out/sad. I just can't take the pain anymore. its worse than anyone knows. idk if it'll ever end &amp; that scares me. 
0,1880032196,Thu May 21 23:53:20 PDT 2009,NO_QUERY,redsam24,14 min. to go.... I have to go  http://plurk.com/p/ves74
0,1880032273,Thu May 21 23:53:21 PDT 2009,NO_QUERY,acarterdntbothr,"@LILBOOTY24 hey, i thought u were gonna take me the next time u went clubbin "
0,1880032286,Thu May 21 23:53:21 PDT 2009,NO_QUERY,gemmak500,Morning all  interweb connection borked here...joy! 
0,1880032304,Thu May 21 23:53:22 PDT 2009,NO_QUERY,aslammemon,"@manojnayak hey manoj, wont be possible for this 23rd, but surely come down for the next one, have fun "
0,1880032529,Thu May 21 23:53:24 PDT 2009,NO_QUERY,BeesLikeZeebras,"@ElectricHAVOK I can't, I have school "
0,1880033088,Thu May 21 23:53:31 PDT 2009,NO_QUERY,C_DIG,"@caninez really? How is it going thus far? And mind if I ask why? ANd btw, I'm sorry I never got to the music, I'm a heel "
0,1880033136,Thu May 21 23:53:31 PDT 2009,NO_QUERY,sophie_olympia,my twitterberry isn't working 
0,1880033670,Thu May 21 23:53:38 PDT 2009,NO_QUERY,leb0priincess,@Raeskies i got into a fight sorta with my cuzn today 
0,1880033980,Thu May 21 23:53:41 PDT 2009,NO_QUERY,drewsterbooster,I'm so mad at myself. I fell asleep during Terminator Salvation. Missed forty minutes of the movie. And NOW I'm wide awake 
0,1880034177,Thu May 21 23:53:43 PDT 2009,NO_QUERY,giannasmiley,I've been having headahces every afternoon for a week now 
0,1880034212,Thu May 21 23:53:43 PDT 2009,NO_QUERY,KarlaMalta,@aleyrose aww aley  it's ok @ashleiL &amp; i will be there soon to try and cheer u up haha
0,1880034218,Thu May 21 23:53:44 PDT 2009,NO_QUERY,voiceovergirl,"@mrtrev might be following your lead, party tomorrow &amp; I've woken up full of cold this morning "
0,1880034307,Thu May 21 23:53:44 PDT 2009,NO_QUERY,KxBxBxKahuku,"@LanceKrall congrats on an awesome show, hope you get renewed unlike the sarah connors chronicles "
0,1880034753,Thu May 21 23:53:50 PDT 2009,NO_QUERY,satoriie,@jaysusjoos that sucks. 
0,1880034866,Thu May 21 23:53:51 PDT 2009,NO_QUERY,sjpfeifer,@britsparley that's not a nice thing to say about your neighbor 
0,1880034938,Thu May 21 23:53:52 PDT 2009,NO_QUERY,arpitnext,@rualthan u will have to miss ... 
0,1880035063,Thu May 21 23:53:54 PDT 2009,NO_QUERY,SammiieXD,i think i might of dislocated my pelvis. again. it is so painful 
0,1880035362,Thu May 21 23:53:57 PDT 2009,NO_QUERY,mustntgrumble,It's the dreaded blood test this morning so I have to administer local anaesthetic cream soon. 
0,1880035549,Thu May 21 23:53:59 PDT 2009,NO_QUERY,IceflowStudios,"Michelle and I wanted to catch a Yankee game during '789', but they're away that whole week. "
0,1880036125,Thu May 21 23:54:06 PDT 2009,NO_QUERY,thraseia,"@killedbyghosts Lucky you, I'm at work "
0,1880036437,Thu May 21 23:54:09 PDT 2009,NO_QUERY,JimmyTIght,@AshleyCandyLand you�re such a beautiful girl....in austria you can�t find beauties as you  love your brazilian touch...
0,1880036580,Thu May 21 23:54:11 PDT 2009,NO_QUERY,ZechariahPilch,@Leslika No...we've cleaned the whole house and Jake's was the only one. 
0,1880036654,Thu May 21 23:54:12 PDT 2009,NO_QUERY,Rellz,Mannn.. My internet is trippn  so its jus the tv and my phone to entertain me.. So sad.
0,1880036829,Thu May 21 23:54:14 PDT 2009,NO_QUERY,ifooch,Has never been so happy to know that i'm going home.... But not until tmrw! 
0,1880037317,Thu May 21 23:54:19 PDT 2009,NO_QUERY,Keryje,"housework done, baby dressed, now gonna sort toddler have shower &amp; face hellish walk uphill to station pushing pram with buggyboard "
0,1880037749,Thu May 21 23:54:25 PDT 2009,NO_QUERY,SweetHeatherMo,"Sweet. Ugh.can't sleep,...wonder why "
0,1880037842,Thu May 21 23:54:26 PDT 2009,NO_QUERY,DivineChihuahua,Pray for me guys... I really wish I wasn't in such pain 
0,1880037973,Thu May 21 23:54:27 PDT 2009,NO_QUERY,lavidacobra,"@vickytcobra omg you poor, poor thing! Are you alright?! You need rest "
0,1880038024,Thu May 21 23:54:27 PDT 2009,NO_QUERY,talliej,Ouch. Bread kinfe: stale bread roll = giant cut on hand too big for Mr Bump Mister Men plaster 
0,1880038397,Thu May 21 23:54:32 PDT 2009,NO_QUERY,hiimclarisa,i realllllllllllllllly don't want to go to school hah too bad i already missed like 16 days this quarter 
0,1880038935,Thu May 21 23:54:38 PDT 2009,NO_QUERY,bondibeachgirl,"@mikegoldmantwit Aghh cant reply back to you, your not following me "
0,1880038998,Thu May 21 23:54:38 PDT 2009,NO_QUERY,rudalevicius,@flyintiger yeah ma dear the lack of time gona be kill us 
0,1880039456,Thu May 21 23:54:44 PDT 2009,NO_QUERY,kayasmith,@meldrum83 you ate a dodgy chicken sandwich from aldi eh? yeuck 
0,1880039461,Thu May 21 23:54:44 PDT 2009,NO_QUERY,swaydehead,An old picture of my babies hugging. I miss my cats  http://i87.photobucket.com/albums/k124/Swaydehead/ZimandGrrr.jpg
0,1880039471,Thu May 21 23:54:44 PDT 2009,NO_QUERY,patrickbrennan9,bed. getting up early to study math tomorrow.  but bridget's home!
0,1880039489,Thu May 21 23:54:44 PDT 2009,NO_QUERY,emmalsegal,"@mowgli786 hey ashy! So I totally forgot, remind me what I said.... "
0,1880039728,Thu May 21 23:54:47 PDT 2009,NO_QUERY,gamesharp,3d hooray! i smashed my ankle and it swelled up. stupid teacher giving bad advice 
0,1880039743,Thu May 21 23:54:47 PDT 2009,NO_QUERY,shadowfax_rulz,@ladyspeaker Ouch! I hope you're okay.  Yep. Heels are the invention of a misogynistic man.
0,1880039744,Thu May 21 23:54:47 PDT 2009,NO_QUERY,greekdude,I'm going to buy shoes  Why can't someone else do that for me?
0,1880039750,Thu May 21 23:54:47 PDT 2009,NO_QUERY,KatieCroston13,up early for doctors  then school abit later. Then a week off. yay.
0,1880040724,Thu May 21 23:54:58 PDT 2009,NO_QUERY,marthaFRESH,"I ask myself why this happens, why these kids get abused, this is horrible  i will have these kids in prayer tonight. This needs 2 stop!"
0,1880041019,Thu May 21 23:55:02 PDT 2009,NO_QUERY,CdnCowgirl,@C_DIG yum! it is a little bad for this hr.. not as bad as what I ate for supper at work 
0,1880041028,Thu May 21 23:55:02 PDT 2009,NO_QUERY,wowlew,isPlayer Has Died! Sorry 
0,1880041045,Thu May 21 23:55:02 PDT 2009,NO_QUERY,knitster,@feebsquared damn! I have plans. That would've been awesome 
0,1880041415,Thu May 21 23:55:06 PDT 2009,NO_QUERY,fiona_mackenzie,@FeriaSpicePower Nope. *sticks head in wardrobe*. Definitely no green. #muftyfail. 
0,1880041455,Thu May 21 23:55:06 PDT 2009,NO_QUERY,natashasaurus,at my cousins and the internets cappe. not much i can do 
0,1880041907,Thu May 21 23:55:11 PDT 2009,NO_QUERY,181743373,so... tired.. but ...can't sleep 
0,1880041989,Thu May 21 23:55:12 PDT 2009,NO_QUERY,magpyr,Fun day planned - have to stock up on make-up and party stuff for Erin's sleep-over..the joy  WHY! hehe
0,1880043753,Thu May 21 23:55:33 PDT 2009,NO_QUERY,MzWordizBond,@cyberprvideo weird. I took a shower and almost blacked out so had to lay down. Sad but true. 
0,1880044320,Thu May 21 23:55:40 PDT 2009,NO_QUERY,himynameisrose,"@saralwin haha i know...it's really scary  lol my friend read marley and me, and i asked wot happened. bad idea haha"
0,1880044506,Thu May 21 23:55:42 PDT 2009,NO_QUERY,Renholder,"@davederoo  no, we were in irvine last night. wanted to do santa barabra too but sadly it wasn't in the cards. "
0,1880044605,Thu May 21 23:55:45 PDT 2009,NO_QUERY,camellia_,@chrsbfflr wtf why not?! 
0,1880044651,Thu May 21 23:55:44 PDT 2009,NO_QUERY,marvink9,What the fuck with Proximus !!! 
0,1880044677,Thu May 21 23:55:44 PDT 2009,NO_QUERY,honeytree87,Is going to miss the AWESOME people she works with 
0,1880045050,Thu May 21 23:55:48 PDT 2009,NO_QUERY,shuklix,@Macy_meghs  haan yaar Hyd days were lovely.. life gets harder as time goes on..  with time it's less and less fun..
0,1880045091,Thu May 21 23:55:49 PDT 2009,NO_QUERY,andy065,@JellieBraden i didnt either  i just woke up from a nap
0,1880045165,Thu May 21 23:55:50 PDT 2009,NO_QUERY,DesireeDoe,"@myloveismusic It really angers me when things like that happen to children. They are innocent, WTF?! "
0,1880045254,Thu May 21 23:55:51 PDT 2009,NO_QUERY,JL_DESIGNS,Didn't finish everything I wanted to finish before leaving for chicago tomorrow...looks like the laptop and client files are coming with 
0,1880045379,Thu May 21 23:55:52 PDT 2009,NO_QUERY,AndyTaylor1244,I'm sitting in the dentist waiting room. About to have more grim work done  can't wait till I'm outta here...
0,1880045560,Thu May 21 23:55:54 PDT 2009,NO_QUERY,Ashkayk,@bdeterding dammit i did  well i kept getting booted off for some reason
0,1880045566,Thu May 21 23:55:54 PDT 2009,NO_QUERY,Daydream09,"My Chest Is Hurting, I'm Going to Lie Down in My Bed. "
0,1880045612,Thu May 21 23:55:55 PDT 2009,NO_QUERY,mrsashian,cant fall asleep.. 
0,1880045658,Thu May 21 23:55:55 PDT 2009,NO_QUERY,SEH63,"My   will turn upside down  when its Football season and I am singing &quot;Here we go Steelers, Here we go!&quot; Clap, Clap!"
0,1880045914,Thu May 21 23:55:58 PDT 2009,NO_QUERY,nazly,@geekaholic yeah they kinda dragged it for long. Coz of critics they want to give and end to it. Will miss Schofield.. 
0,1880045975,Thu May 21 23:55:59 PDT 2009,NO_QUERY,the_only_chad,"@claudiachaouka1 oh it's real food poisoning, that's no fun  hope you're feeling better soon "
0,1880046212,Thu May 21 23:56:02 PDT 2009,NO_QUERY,jrstanley,"Not slept yet, quite tired so should do so... except it's supposed to be a very nice day so I don't really want to "
0,1880046348,Thu May 21 23:56:03 PDT 2009,NO_QUERY,18percentgrey,"@Liney Liney, I miss VHS tapes.  sure they're ugly, but the ones I have from 25 years ago still work.. cant say same of some 5yo dvds. "
0,1880046668,Thu May 21 23:56:06 PDT 2009,NO_QUERY,davidwenban,Is about to sit the PRINCE2 practitioner exam!  Fingers crossed!
0,1880046730,Thu May 21 23:56:07 PDT 2009,NO_QUERY,rosemeagan,I have six fckin mosquito bites from Sunday that are buggin the shit outta me! They're so damn itchy!!! 
0,1880046913,Thu May 21 23:56:09 PDT 2009,NO_QUERY,cinDysLicK,@hitwithabrick that sounds delicious!  haven't seen any taco bells here.   nor chipotle.  me wantsa a burrito treatzzzz!
0,1880046997,Thu May 21 23:56:10 PDT 2009,NO_QUERY,mkrissy,wants to get rid of my phone 
0,1880047011,Thu May 21 23:56:10 PDT 2009,NO_QUERY,megan_kelli,"hello, someone talk to me, please? i'm bored "
0,1880047209,Thu May 21 23:56:12 PDT 2009,NO_QUERY,autumnmariegray,ugh bed time 
0,1880047378,Thu May 21 23:56:14 PDT 2009,NO_QUERY,Dogbook,Nuke Peterson-Evans is missing dad  come home please!!! http://apps.facebook.com/dogbook/profile/view/5573034
0,1880047494,Thu May 21 23:56:15 PDT 2009,NO_QUERY,siphilp,Good morning people. Friday at last. Start of the day speaking to Vodaphone 
0,1880047835,Thu May 21 23:56:19 PDT 2009,NO_QUERY,TagAlongTess,"@bethanie Ok, I'll do the &quot;I hate apostrophes in the wrong spot&quot; song. It doesn't sound quite as catchy as yours "
0,1880048039,Thu May 21 23:56:21 PDT 2009,NO_QUERY,Allyandra85,is gettin rather vexed at her self arghhh y cant i find a job  any1 wana give me 1?
0,1880048361,Thu May 21 23:56:25 PDT 2009,NO_QUERY,DeborahMariee,I'm on my way to school. Last Friday of school 
0,1880048436,Thu May 21 23:56:26 PDT 2009,NO_QUERY,hollygable,Last day at 6th form college today  Afternoon off getting drunkaaaard with the teachers in whetherspooons should be interesting ;)
0,1880048503,Thu May 21 23:56:27 PDT 2009,NO_QUERY,bunnychicksf,Really sad - had a fight w/friend last week over something silly.  I apologized but he still hasn't called - I don't think he will 
0,1880048777,Thu May 21 23:56:30 PDT 2009,NO_QUERY,R_k309,im sooo tired and i cant sleep cuz my head suddenly decides to hurt..  its almost 3 in the morning! 
0,1880049068,Thu May 21 23:56:33 PDT 2009,NO_QUERY,supersweetmack,@susannaelyse I came out to hang with you and you were gone... And I called you 
0,1880049121,Thu May 21 23:56:34 PDT 2009,NO_QUERY,Lucilu,"Woo. On the bus, then to @doppleganger_ 's place to play MadWorld. Awesome. It's still freaking cold  http://mobypicture.com/?vng94j"
0,1880049382,Thu May 21 23:56:37 PDT 2009,NO_QUERY,cindydisaster,@fadedmoon awwe..hey..i have to g2 bed   chat later? :]
0,1880049491,Thu May 21 23:56:38 PDT 2009,NO_QUERY,Suiken,"In other news, leg cramps in your calves hurt. A lot. "
0,1880049643,Thu May 21 23:56:40 PDT 2009,NO_QUERY,BenStokell,"is pleased that it's friday, but school is going to be such an anticlimax after the circus "
0,1880049747,Thu May 21 23:56:41 PDT 2009,NO_QUERY,imnickyip,@alexkillby thats so meannnnn!! i dont do that 
0,1880049895,Thu May 21 23:56:43 PDT 2009,NO_QUERY,SHRMYWRLD,thinkz itz gonna b a looonnnggg 5 days....   @ tHa fiGHt or fliGht staGe... http://loopt.us/8D8H6Q.t
0,1880050082,Thu May 21 23:56:45 PDT 2009,NO_QUERY,SEH63,Ok I meant my  will turn right side up ....get it? got it? GOOOOOOD!
0,1880050443,Thu May 21 23:56:49 PDT 2009,NO_QUERY,BernatMommy,"good niteeh tweeters and facebookers, I've lost my battle to exhaustion  Hello gorgeous pillow!"
0,1880050667,Thu May 21 23:56:52 PDT 2009,NO_QUERY,romannikoles,im sick of Subway. i just wanna go home and sleep! 
0,1880050803,Thu May 21 23:56:54 PDT 2009,NO_QUERY,jennysunphoto,i dont care what anyone thinks... that coronation song for the american idol finale was AWFUL.... poor kris 
0,1880051062,Thu May 21 23:56:57 PDT 2009,NO_QUERY,tramainesimone,headed to bed..its been a long day.i should be getting ready 4 work in the morning  good nite
0,1880051160,Thu May 21 23:56:58 PDT 2009,NO_QUERY,JennRansom,@melmartinezrock http://bit.ly/9i7Tp  but this is just part of it.  it looks interesting. ha.
0,1880051183,Thu May 21 23:56:58 PDT 2009,NO_QUERY,MissNP,@LoLoTX what?! Why didn't I know that the bars stay open late now?? I guess this confirms that I have no life! Sad 
0,1880051573,Thu May 21 23:57:03 PDT 2009,NO_QUERY,sonyakeith,Why?!? My neighbor put a password on the wireless connection! Must learn how to make Crackberry a modem! 
0,1880051821,Thu May 21 23:57:05 PDT 2009,NO_QUERY,zozo1976,is upset cause i am not at the pussycat dolls and lady gaga concert 
0,1880052030,Thu May 21 23:57:08 PDT 2009,NO_QUERY,youngcobris,AWW...HE'S TRYING TO KILL HIS BROTHERS WIFE... 
0,1880052235,Thu May 21 23:57:10 PDT 2009,NO_QUERY,aaronjuly,I think I pissed off JTF 
0,1880052632,Thu May 21 23:57:14 PDT 2009,NO_QUERY,HannahDanC,Will only cry in sad Movies when by myself 
0,1880052778,Thu May 21 23:57:16 PDT 2009,NO_QUERY,deninta,"lagi di facial. aw men, now it hurts "
0,1880053193,Thu May 21 23:57:20 PDT 2009,NO_QUERY,wptavern,"Hmm, I think I should move the post ratings from the side bar into the post content. Barely anyone rates posts "
0,1880053333,Thu May 21 23:57:22 PDT 2009,NO_QUERY,dystracted1,had a horriable headache all day..  so much for a great day off. went to cub to get some grub..
0,1880053407,Thu May 21 23:57:23 PDT 2009,NO_QUERY,AliceeXD,"Over alexs house, about to leave for school "
0,1880053562,Thu May 21 23:57:25 PDT 2009,NO_QUERY,InfiPP,@lharp AIR (FlahVM) is _badly_ needed for extra platforms. As real interoperability is very limited now 
0,1880053566,Thu May 21 23:57:25 PDT 2009,NO_QUERY,winterfoxf,crap..... i dont think theres been a day this week when i've gone to bed before @thedartmouth tweets out the news......... 
0,1880053765,Thu May 21 23:57:27 PDT 2009,NO_QUERY,aliyoopah,I feel so inactive since I came back from the US! I wanna go back there so badly! 
0,1880053775,Thu May 21 23:57:27 PDT 2009,NO_QUERY,flashodad,"ewww...something nasty just came out of the sink faucet in my bathroom.    I'm thirsty, but I'm not about to drink water from there."
0,1880053810,Thu May 21 23:57:27 PDT 2009,NO_QUERY,123PMG,terrential downpour waiting at bustop.thank god 4 wongy with the umbrella. slightly damp now+exam hatred 
0,1880054315,Thu May 21 23:57:33 PDT 2009,NO_QUERY,archonline,@aDeSe yes.. the chillness of blore is returning... mayb due to the rains... 
0,1880054576,Thu May 21 23:57:36 PDT 2009,NO_QUERY,Bonkajs,vien?gi s?d?gs laiks un tur nav kur auto nomest 
0,1880054771,Thu May 21 23:57:38 PDT 2009,NO_QUERY,cleopatraloves,btw i totally miss having my blackberry or might i say crackberry... my mums teaching me a lesson for losing it no new one for me 
0,1880054813,Thu May 21 23:57:39 PDT 2009,NO_QUERY,saramarietexas,"@supersweetmack oh I'm sorry thats kind of my fault. The show ended super early &amp; I had to take her back to her car, &amp; her phone died. "
0,1880055170,Thu May 21 23:57:43 PDT 2009,NO_QUERY,MsKaylaV,Got a Bad headache 
0,1880055177,Thu May 21 23:57:43 PDT 2009,NO_QUERY,bighobin,too many peanut butter m &amp; ms no good  lol
0,1880055388,Thu May 21 23:57:46 PDT 2009,NO_QUERY,JodieRus,"Has the naughtiest cats. Franks a fluffball, i wish i could take him to work. "
0,1880055441,Thu May 21 23:57:46 PDT 2009,NO_QUERY,epilnivek,"To be precise, my MacBook Pro's left fan is loud now, emitting a pitch that's a quarter-tone between B and C, one octave up from middle C "
0,1880055444,Thu May 21 23:57:46 PDT 2009,NO_QUERY,wowlew,isPlayer Has Died! Sorry 
0,1880055450,Thu May 21 23:57:46 PDT 2009,NO_QUERY,erinschmidt,"back hurts, brain hurts, hurties hurt. wanna go home, but not looking forward to traffic.  Where's that knight, he should be along soon?"
0,1880055461,Thu May 21 23:57:47 PDT 2009,NO_QUERY,ShanSoPink,talking to my honey i miss him 
0,1880055696,Thu May 21 23:57:49 PDT 2009,NO_QUERY,iilyndaii,"@SarahKSilverman They don't have to be OLD men - some of us are younger, not married, no family &amp; extremely lonely.  "
0,1880055975,Thu May 21 23:57:53 PDT 2009,NO_QUERY,jjpprob,Stressing out about Computer Architecture exam. Why do they make us learn this? I doubt I'll ever really need to use most of it 
0,1880056044,Thu May 21 23:57:53 PDT 2009,NO_QUERY,GotPickles,Just watched 7 Pounds again..  had a good cry     now im going to bed.. goodnight everyone
0,1880056116,Thu May 21 23:57:54 PDT 2009,NO_QUERY,lauren_fishkin,"@yikesjames Duuuude, right? Just wait! Can't believe 6 won't be out until next year! Now I have to wait for Lost and SP!! "
0,1880056311,Thu May 21 23:57:56 PDT 2009,NO_QUERY,Venus30,Hye! twitpic. Where did you hide another one? 
0,1880056518,Thu May 21 23:57:59 PDT 2009,NO_QUERY,bre1089,@itsthenew 
0,1880056648,Thu May 21 23:58:01 PDT 2009,NO_QUERY,nigelramsay,"@rickerbh thanks, you're right - they're certainly examples of dashboards... but not so sure how many of them are good "
0,1880056792,Thu May 21 23:58:03 PDT 2009,NO_QUERY,branlynn,OH REALLY SPRINT? damn it. I can only receive calls until the morning when I call and find out what the hell happened... boo 
0,1880057143,Thu May 21 23:58:07 PDT 2009,NO_QUERY,alexkillby,@imnickyip well just think how inconsiderate those other people are being to you 
0,1880057457,Thu May 21 23:58:10 PDT 2009,NO_QUERY,CourtneySusanne,I missed almost the entire hockey game.....   must've slipped into a coma earlier @tat2dsteelergal  Good Morning!
0,1880057524,Thu May 21 23:58:11 PDT 2009,NO_QUERY,charliieexx,"broke my nail, really badly... blood everywhere, i was crying "
0,1880057616,Thu May 21 23:58:12 PDT 2009,NO_QUERY,jessyybrahh,Just realised I missed lady gaga on nova this morning... devo 
0,1880057683,Thu May 21 23:58:13 PDT 2009,NO_QUERY,karatekid_,Wants to be there. Now. Noww. 
0,1880057685,Thu May 21 23:58:13 PDT 2009,NO_QUERY,Asgard_,@_Nancy_  que tienes ? 
0,1880057692,Thu May 21 23:58:13 PDT 2009,NO_QUERY,lucytaylor123,"Sorry havent tweeted been super busy  so catch up,"
0,1880057710,Thu May 21 23:58:13 PDT 2009,NO_QUERY,rosewal,@feebsquared Ohh I wanna come to that but I have to werk  Have an ace time
0,1880057917,Thu May 21 23:58:15 PDT 2009,NO_QUERY,kskarun,"@prempanicker I started using #iplonair for commentary gems, but stopped using it since I was the only one "
0,1880058325,Thu May 21 23:58:20 PDT 2009,NO_QUERY,NOTjanelle,"I've had to clear my inbox today TWICE, and now...no one's textin me anymore "
0,1880058426,Thu May 21 23:58:21 PDT 2009,NO_QUERY,paranoia_suxx,I am up waaaaay to early considering I have nothing to do today. I blame my stupid ear 
0,1880058722,Thu May 21 23:58:25 PDT 2009,NO_QUERY,Panda_s1,"@Lyzee42 Oh dear, I hope she's okay "
0,1880058985,Thu May 21 23:58:28 PDT 2009,NO_QUERY,SarahMorrison,I am gonna throw up again 
0,1880059055,Thu May 21 23:58:29 PDT 2009,NO_QUERY,hayles,"It was so nice and sunny this morning, now it's raining and grey "
0,1880059058,Thu May 21 23:58:29 PDT 2009,NO_QUERY,VegasDiamond,"@krystaldelacruz I know, my husband is pissed off "
0,1880059061,Thu May 21 23:58:29 PDT 2009,NO_QUERY,idazlious,5) Stuff my face with food 6) Pick my mum up lol 7) Do the washing.  8) Twitter. 9) Get more money.
0,1880059191,Thu May 21 23:58:31 PDT 2009,NO_QUERY,mmacrae48,not liking ga weather! 
0,1880059445,Thu May 21 23:58:34 PDT 2009,NO_QUERY,bitchRix,missing someone..  can't believe i will miss him..
0,1880060096,Thu May 21 23:58:42 PDT 2009,NO_QUERY,heytheregloria,Im stupid. Really really dumb. 
0,1880060195,Thu May 21 23:58:43 PDT 2009,NO_QUERY,chocolate_dip,@nettabrielle congrats girl!! I wish I wasn't at work tonight  but I know you did wonderfully! I'm soooooo proud of you!!
0,1880060332,Thu May 21 23:58:45 PDT 2009,NO_QUERY,DivineChihuahua,@RnRyorkiemom They treat me like I'm making up the pain to get pills regardless of my diagnosis of Fibromyalgia. It's really frustrating 
0,1880060855,Thu May 21 23:58:51 PDT 2009,NO_QUERY,RAVERJONO,"Just got home. Good afternoon, although I forgot to get my lightbulb. "
0,1880060967,Thu May 21 23:58:52 PDT 2009,NO_QUERY,rubyrafael,"Got headache  so,i shouldnt have to attend LIA,should i? mmmph"
0,1880061097,Thu May 21 23:58:54 PDT 2009,NO_QUERY,phantastic95,I'd love the song Every Part Of Me but it's not been released or leaked HQ full yet 
0,1880061324,Thu May 21 23:58:57 PDT 2009,NO_QUERY,GarageGlamorous,@popbytes I swear I was supposed to live through that era...but something went horribly wrong 
0,1880061339,Thu May 21 23:58:57 PDT 2009,NO_QUERY,msslf7,@queenmeemee thatgon be cool for the holiday. Going to the A? I gotta work this weekend  boooooo
0,1880061457,Thu May 21 23:58:58 PDT 2009,NO_QUERY,mariusoczon,@m3anstreak me too. 
0,1880061521,Thu May 21 23:58:59 PDT 2009,NO_QUERY,atarigeek,@hugosdad sorry  im sure thats my fault
0,1880062119,Thu May 21 23:59:05 PDT 2009,NO_QUERY,ganeshkn,Datacard not working.. browsing frm office.. 
0,1880062598,Thu May 21 23:59:11 PDT 2009,NO_QUERY,chrismahon,"@jonathanchong By the way dude, having to work from home again as machine still not setup "
0,1880063195,Thu May 21 23:59:18 PDT 2009,NO_QUERY,N_sweetie,its winter im cold   my sailor is away so sleeping alone again tonight.
0,1880063295,Thu May 21 23:59:19 PDT 2009,NO_QUERY,chadfu,@teeeeeef I hear ya! I can't imagine being twitterless...I don't know what the answer is. 
0,1880063585,Thu May 21 23:59:22 PDT 2009,NO_QUERY,Thalia_S,@RosaStergio den tha erthw telika shmera poulaki...   isws na meinw to sabbato thes/niki.tha doume.etsi ki alliws tlm aurio apo konta!
0,1880063703,Thu May 21 23:59:23 PDT 2009,NO_QUERY,deedeeamin,is having a major soar throat. 
0,1880064069,Thu May 21 23:59:28 PDT 2009,NO_QUERY,Socks01,Half the skools gone and theres only 50 peeps left 
0,1880064426,Thu May 21 23:59:32 PDT 2009,NO_QUERY,rachborntorun,It's so early   
0,1880065089,Thu May 21 23:59:39 PDT 2009,NO_QUERY,OGemilyhall,Dad closed the family business  tonight after 100 years in the movie business       http://bit.ly/vG0OA
0,1880065129,Thu May 21 23:59:39 PDT 2009,NO_QUERY,jose9,Too many Friday lollies 
0,1880065846,Thu May 21 23:59:47 PDT 2009,NO_QUERY,MZenani,@ilikecupcakes that?sucks balls. I'm sorry. A Toyota clipped my back wheel when I was changing lanes on the 105 and he sped up to stop me 
0,1880066094,Thu May 21 23:59:50 PDT 2009,NO_QUERY,lezizzle,@akennedy23 june can't come soon enough   insufficient
0,1880066264,Thu May 21 23:59:52 PDT 2009,NO_QUERY,JoshuaSacramoni,"up at 7:45am.......not a morning person, particularly when it comes to being up to revise before a 9.30 exam "
0,1880066443,Thu May 21 23:59:54 PDT 2009,NO_QUERY,MadreDeLosGatos,@mimirenee 
0,1880066684,Thu May 21 23:59:58 PDT 2009,NO_QUERY,KyzerSoze,my work week begins here 
0,1880066885,Fri May 22 00:00:00 PDT 2009,NO_QUERY,Brenna_Bee,hates being broke  especially on the weekend to cause all i wana do is go out
0,1880068812,Fri May 22 00:00:15 PDT 2009,NO_QUERY,Haley311,"srs bsns circulating around the 311BB, and its keeping me up past 3AM "
0,1880069275,Fri May 22 00:00:18 PDT 2009,NO_QUERY,ravikanth,oops...just realized that my car insurance got expired  calling up those folks
0,1880069320,Fri May 22 00:00:19 PDT 2009,NO_QUERY,vanessawest,@nagelface Awww so sweet! I'm sad that I had to miss it 
0,1880069460,Fri May 22 00:00:20 PDT 2009,NO_QUERY,Mandyboo92,my baby went to sleep  boreddd!
