0,2014468364,Wed Jun 03 01:37:54 PDT 2009,NO_QUERY,JodiJo18,itz 4:37 in the mornin n i cnt sleep n on top of that..IM WASSTTTTEEDDD!!...sike nah but i cnt sleep doe 
0,2014469424,Wed Jun 03 01:38:06 PDT 2009,NO_QUERY,leehuiyen,"Dr took my weight today and told me that I am 44 kg, then I ask her &quot;Explain why I look so F.A.T, if thats the case?&quot; "
0,2014469620,Wed Jun 03 01:38:09 PDT 2009,NO_QUERY,bethwhatcanido,@miss_murphy oh god its so uncomfortably sexual &quot;uhhhh I wanna give myself a papercut now&quot; she took down the kebab one though! 
0,2014469953,Wed Jun 03 01:38:13 PDT 2009,NO_QUERY,Janicza,@HeartMileyCyrus Don't want to talk to me 
0,2014470142,Wed Jun 03 01:38:15 PDT 2009,NO_QUERY,bderenorcaine,just came back from ameeting with my thesis advisor. forgot about half of the stuff we talked about last time. epic FAIL 
0,2014470930,Wed Jun 03 01:38:26 PDT 2009,NO_QUERY,katrinabarlow,doesn't want to do all this work!!  xx
0,2014471149,Wed Jun 03 01:38:29 PDT 2009,NO_QUERY,beccxxx,i'mma wannah go home  i hate twatty people at school
0,2014471200,Wed Jun 03 01:38:29 PDT 2009,NO_QUERY,hellopaulina,have to go visit my horse in the meadows... and it's pouring rain.. 
0,2014471921,Wed Jun 03 01:38:38 PDT 2009,NO_QUERY,LloydDavis,"hoping to get to #ecsm this afternoon, though that means I'll miss @cybersoc's preso  I'm speaking tomorrow morning"
0,2014471947,Wed Jun 03 01:38:38 PDT 2009,NO_QUERY,leonakimeera,Back and still feeling shattered. Still no cockney... I'm ashamed to say. 
0,2014472056,Wed Jun 03 01:38:40 PDT 2009,NO_QUERY,brownblonde,"little one is sporting his first two molars. two at once!  no wonder he was grouchy. tonight's a little easier than last, so far."
0,2014472212,Wed Jun 03 01:38:42 PDT 2009,NO_QUERY,laceyee,"what's the use of telling, your still going anyways..  ill wait till it fades away.. hopeful.."
0,2014472220,Wed Jun 03 01:38:42 PDT 2009,NO_QUERY,ficklemary,Where are you Monica Oropel??? 
0,2014472288,Wed Jun 03 01:38:43 PDT 2009,NO_QUERY,daisypops,My iPhone is going to iPhone hospital tomorrow 
0,2014472493,Wed Jun 03 01:38:46 PDT 2009,NO_QUERY,AlyxxDione,@BobbyTommy awww dangg soo you can see nuthin on theree? 
0,2014473136,Wed Jun 03 01:38:53 PDT 2009,NO_QUERY,OmgATiger,"@evan_a Yeah, I have a couple others, a PC laptop and a few desktop computers, but this'll always be my favorite. "
0,2014473256,Wed Jun 03 01:38:55 PDT 2009,NO_QUERY,jadelouiseee,"has a cough, cold, sore belly, headache &amp; is dizzy "
0,2014473474,Wed Jun 03 01:38:58 PDT 2009,NO_QUERY,emmacourtney85,@scholesy111 no prob not havent been busy in months  yeah it's just nice today yesterday was far too hot
0,2014474133,Wed Jun 03 01:39:06 PDT 2009,NO_QUERY,virgildeuce,"hmm, a record. six hours later urine still smell like asparagus, or that chemical in it how about that "
0,2014474711,Wed Jun 03 01:39:13 PDT 2009,NO_QUERY,savagestar,"@phunybuny Night! &lt;3 So happy for ya! And wait, 15 peeps at the show? awww "
0,2014474716,Wed Jun 03 01:39:13 PDT 2009,NO_QUERY,gr00vy_curta1n5,I'm not feeling the news at all. 
0,2014475668,Wed Jun 03 01:39:25 PDT 2009,NO_QUERY,lord_phoenix,@Nokiausers Me not 
0,2014476305,Wed Jun 03 01:39:32 PDT 2009,NO_QUERY,mikkimoo1,Waiting at the dentist for a filling 
0,2014476327,Wed Jun 03 01:39:33 PDT 2009,NO_QUERY,llegrats87,@SoCockii yeah but only in the day time . . . Sadly I work night shift. 
0,2014476533,Wed Jun 03 01:39:35 PDT 2009,NO_QUERY,diannetic,says it's a long and scary extended vacation  http://plurk.com/p/y2xes
0,2014476901,Wed Jun 03 01:39:40 PDT 2009,NO_QUERY,arpita_datta271,looks like tonight too i shall be holed up 
0,2014477033,Wed Jun 03 01:39:42 PDT 2009,NO_QUERY,ralpharama,"God, 10mins into train journey and it already feels long.  AND its too early for wine..."
0,2014478339,Wed Jun 03 01:39:58 PDT 2009,NO_QUERY,benhamv,Up too late (or too early).  Kid crying from bad dreams 3x.  
0,2014478412,Wed Jun 03 01:39:59 PDT 2009,NO_QUERY,emisoraradio,"I'm sorry @khatijah I can't &quot;kesian&quot; Mr. Brown, the man's too soporific! "
0,2014479794,Wed Jun 03 01:40:13 PDT 2009,NO_QUERY,bathbomb,And...the pool is shut. No swimming for Emma. 
0,2014480046,Wed Jun 03 01:40:16 PDT 2009,NO_QUERY,adachow,someone tell me what to do 
0,2014480339,Wed Jun 03 01:40:20 PDT 2009,NO_QUERY,werlecar,"My cat Tiger was hit by a car one week from today.  I miss his quiet yawns, his staring eyes.  He was always ready for a stretch "
0,2014480517,Wed Jun 03 01:40:22 PDT 2009,NO_QUERY,BossTycoonLZ,Well I think I might try to go to bed again... my husband has stopped texting for the time being...   miss himm to death...
0,2014480533,Wed Jun 03 01:40:22 PDT 2009,NO_QUERY,mikabompz,says my karma isn't getting any higher  please help me (tears) http://plurk.com/p/y2xmo
0,2014480629,Wed Jun 03 01:40:23 PDT 2009,NO_QUERY,BrentMcGuire,all of a sudden im craving an egg mcmuffin and a large coffee! My 9 year old sleeps for another couple of hours... 
0,2014480917,Wed Jun 03 01:40:26 PDT 2009,NO_QUERY,teddyrised,@amourchaleur Ooooh. Does it disturb you if I said I ate at least two packets? Around 30 lozenges each. I'm a compulsive candy monster 
0,2014481182,Wed Jun 03 01:40:30 PDT 2009,NO_QUERY,ReflexGTI,bleh. this 3rd shift schedule is odd.. im going to bed when people wake up  night!
0,2014481519,Wed Jun 03 01:40:34 PDT 2009,NO_QUERY,innaamwaa,Frustated. Disappointed and other synonyms for this two words. - dropitonadime: Aw  i thought you already... http://tumblr.com/xwz1xt7ee
0,2014481553,Wed Jun 03 01:40:34 PDT 2009,NO_QUERY,joolznjay,"joolz is gettin ready for work again....jay already there,poor thing "
0,2014481859,Wed Jun 03 01:40:37 PDT 2009,NO_QUERY,boogie_shoes,Packing for me and the boy  city breaks make for tough packing
0,2014481961,Wed Jun 03 01:40:39 PDT 2009,NO_QUERY,SarahPOWW,Wants to see you NOW  Gay school ¬¨_¬¨ &lt;3
0,2014482105,Wed Jun 03 01:40:40 PDT 2009,NO_QUERY,xElenixMartianx,I can't fucking believe it!!! 
0,2014482664,Wed Jun 03 01:40:47 PDT 2009,NO_QUERY,alanawilliamson,ewww i think i ate the sticker 
0,2014482832,Wed Jun 03 01:40:49 PDT 2009,NO_QUERY,Juzley,Experiment failure: no breast enlargement specialists are following me 
0,2014483117,Wed Jun 03 01:40:53 PDT 2009,NO_QUERY,karunaseo,@VerticalLeap thought social media was untouched by spam till date... 
0,2014483537,Wed Jun 03 01:40:59 PDT 2009,NO_QUERY,banerji1,Murray out of the French Open yesterday ... boo ...   but at least he made it to the quarter finals ... Nadal didnt mange that ....!
0,2014483828,Wed Jun 03 01:41:02 PDT 2009,NO_QUERY,RedCellStudio,"Trying out #Spymaster see how that goe's, they want me to spam here to get more funds thats a minus point "
0,2014484428,Wed Jun 03 01:41:09 PDT 2009,NO_QUERY,AndrewWoody,@SimWood That would assume I lived somewhere that had 3G - don't even get mobile signal on O2 at home 
0,2014484864,Wed Jun 03 01:41:14 PDT 2009,NO_QUERY,chuckstar76,"wfh today, no guesses what I'm doing - yup excel, excel, excel... Reminds me of the 'Skol' slogan... but 'cell, cell, cell,...' "
0,2014484973,Wed Jun 03 01:41:15 PDT 2009,NO_QUERY,SerenaJ,@CrunchyK agree w/ u re families and loved ones of the flight 447 find comfort---very tragic indeed no words at all 
0,2014485144,Wed Jun 03 01:41:17 PDT 2009,NO_QUERY,britkneelynn,I. Hate. Ants. 
0,2014485157,Wed Jun 03 01:41:17 PDT 2009,NO_QUERY,virgildeuce,"a record, six hours later, urine still smells like that asparagus chemical. how about that? "
0,2014485224,Wed Jun 03 01:41:18 PDT 2009,NO_QUERY,Bruno108,@Cinderell4 hey! not much! mi annoio!  tu??
0,2014485504,Wed Jun 03 01:41:21 PDT 2009,NO_QUERY,corkyweinerdog,hates when spiders use her own hair against her  not cool!
0,2014485521,Wed Jun 03 01:41:21 PDT 2009,NO_QUERY,harrietrose,First exam today.. ARRRGGGHHHH! Stress 
0,2014485610,Wed Jun 03 01:41:22 PDT 2009,NO_QUERY,NoahReich,I want to be asleep by 3!  Why does that seem so unlikely?   DONT GIVE UP!
0,2014485835,Wed Jun 03 01:41:25 PDT 2009,NO_QUERY,violetbakes,"my connection is playing up really badly this morning, I've had to re-boot 3 times "
0,2014486090,Wed Jun 03 01:41:28 PDT 2009,NO_QUERY,FootballRamble,"@itsmattli Very true, but if it's not that transfer, it'll be another one, sadly "
0,2014486257,Wed Jun 03 01:41:31 PDT 2009,NO_QUERY,Mz090909,"@thestuntdude   awww, wish I could have been there   have fun!!!"
0,2014486641,Wed Jun 03 01:41:35 PDT 2009,NO_QUERY,Kat_La,"@Twilighter_OfOz yeah ok, just got a headache  what u doing?"
0,2014486681,Wed Jun 03 01:41:36 PDT 2009,NO_QUERY,BigMocha,Chelsie just left....I am by myself again and it is raining here in SATX 
0,2014486816,Wed Jun 03 01:41:38 PDT 2009,NO_QUERY,jfrhodes,@arsachs my dream is to be on cash cab. i exclusively take van cabs to try to make this dream a reality...still no dice dude!! 
0,2014486877,Wed Jun 03 01:41:39 PDT 2009,NO_QUERY,CherylH77,@Miss_Chicken wishful thinking for me 
0,2014486922,Wed Jun 03 01:41:39 PDT 2009,NO_QUERY,twistedpuppet,@butterfly269200  Hey! You're not tweeting to me.   And you didn't come see me neither.
0,2014487609,Wed Jun 03 01:41:48 PDT 2009,NO_QUERY,Hades32,"@Hicksdesign Your skin is really fits nicely with the visual tabs, but: Is there a quick fix to get them on the left? "
0,2014487632,Wed Jun 03 01:41:49 PDT 2009,NO_QUERY,QueensleyFelix,@yasexy keri has way better vocals but she can't dance really!!  but she's wayyyy prettier!!! I liked keri more with a techno pop sound
0,2014487798,Wed Jun 03 01:41:51 PDT 2009,NO_QUERY,TGallacher,@steveyoung74 
0,2014488073,Wed Jun 03 01:41:55 PDT 2009,NO_QUERY,insertsmiley,@sarahteaa omg i saw this ivory white piano in this chick's video clip and it was so damn pretty. i want it 
0,2014488140,Wed Jun 03 01:41:56 PDT 2009,NO_QUERY,SlainwithSatan,@zincink I'm banned from good old chatsville 
0,2014488524,Wed Jun 03 01:42:01 PDT 2009,NO_QUERY,winterchick12,"i kind of feel bad about what i wrote earlier, i didnt mean it 2 sound so...grouchy "
0,2014488638,Wed Jun 03 01:42:02 PDT 2009,NO_QUERY,Billiejoe3,It's cold  I need some kind of breakfast...
0,2014488959,Wed Jun 03 01:42:09 PDT 2009,NO_QUERY,YODOT,@JaylaStarr what about me???  .... J/k lol
0,2014489046,Wed Jun 03 01:42:07 PDT 2009,NO_QUERY,maryanntii,By2's songs didn't appear on my blog 
0,2014489062,Wed Jun 03 01:42:07 PDT 2009,NO_QUERY,TeresaMarin,@Heragui me too! hahaa i want to be richhh  LOL
0,2014489640,Wed Jun 03 01:42:14 PDT 2009,NO_QUERY,Dreamyeyes,@ARealist i miss that girl too   @royalscorpion
0,2014489765,Wed Jun 03 01:42:16 PDT 2009,NO_QUERY,janebyford,"@jussinen Thanks for reply.  Twitter status is fine, just can't access from mobile anymore.  Have logged Twitter support call.  "
0,2014489872,Wed Jun 03 01:42:17 PDT 2009,NO_QUERY,MaanElizabeth,Im so hating the rain!!! 
0,2014489900,Wed Jun 03 01:42:17 PDT 2009,NO_QUERY,jonnymccreedy,"@mintpea Hi Hannah! Twitter kicks ass, no? I prefer it in a way to Fb but few here in UU use it.  Hopefully that will change! How's things"
0,2014489933,Wed Jun 03 01:42:17 PDT 2009,NO_QUERY,scholesy111,@Kissmekayley 1st you don't read my DM then you be nasty to me. A Man knows when he's not wanted. 
0,2014490050,Wed Jun 03 01:42:19 PDT 2009,NO_QUERY,minauderie,"Parallel parking today in driver's ed, and GOD, i don't want to. "
0,2014490094,Wed Jun 03 01:42:20 PDT 2009,NO_QUERY,sk8rfish,"Bouncing through Kincorth in a rickety old post van, slightly late start, moderately heavy bags... No early finish today "
0,2014490627,Wed Jun 03 01:42:26 PDT 2009,NO_QUERY,sbwhyte,"Tired n' grumpy this morning. I have to get a new phone, the other one broke on Sun "
0,2014490945,Wed Jun 03 01:42:30 PDT 2009,NO_QUERY,Zehavit_Lamasu,GAH!  I hate it when my children get a fever in the summer   stupid bugs!  STUPID WEATHER!!!
0,2014491523,Wed Jun 03 01:42:37 PDT 2009,NO_QUERY,originalkitten,@viky_faxerfeit lol the new one is poserpro but best to have 64bit processor to get optimal usage. I dont 
0,2014491971,Wed Jun 03 01:42:42 PDT 2009,NO_QUERY,kisluvkis,"@hobbinator Im not a foster thru a group, so no. I just get who I find! &amp; my main rescue I'd join is struggling so not taking new cats "
0,2014491978,Wed Jun 03 01:42:42 PDT 2009,NO_QUERY,LeO_iz_me,i miss u so much 
0,2014492025,Wed Jun 03 01:42:43 PDT 2009,NO_QUERY,ashyboi88,"the course i wanted to do @RMIT was cancelled, so now i'm screwed coz there's nothing similar offered that i can do instead "
0,2014492041,Wed Jun 03 01:42:43 PDT 2009,NO_QUERY,InggoTweets,has failed defeating Don Giuvanni using @Suff's lv85 sheep. orz  http://plurk.com/p/y2y7x
0,2014492190,Wed Jun 03 01:42:45 PDT 2009,NO_QUERY,RealJackieB,i miss you... 
0,2014492280,Wed Jun 03 01:42:46 PDT 2009,NO_QUERY,rissarr,"at college, study skills exam today "
0,2014492354,Wed Jun 03 01:42:47 PDT 2009,NO_QUERY,heroesnphotoes,can't log on the dlist chatroom 
0,2014492616,Wed Jun 03 01:42:50 PDT 2009,NO_QUERY,bialaurel, baby ethans leaving for the PI tomorrow.
0,2014492992,Wed Jun 03 01:42:56 PDT 2009,NO_QUERY,fluffyemily,my pleasant home working morning is being ruined by the builders taking down the scaffolding around the building. I'm getting a headache 
0,2014493372,Wed Jun 03 01:43:01 PDT 2009,NO_QUERY,squinsee,@BLE1 moving to caledonian road - so not far but dont think can call it bloomsbury  but do have flat with a massive garden
0,2014493855,Wed Jun 03 01:43:06 PDT 2009,NO_QUERY,jinnpod,@Wolfgang_ oh dear... 
0,2014493864,Wed Jun 03 01:43:06 PDT 2009,NO_QUERY,amirahsyazwani,paper works...paper works...paper cuts... 
0,2014493921,Wed Jun 03 01:43:07 PDT 2009,NO_QUERY,MickFealty,@CIF_Jessica I regret to say that I suspect that time is long past... 
0,2014493963,Wed Jun 03 01:43:08 PDT 2009,NO_QUERY,hollyhalloween,sitting waiting!!!!! Mssing Abby!!!! 
0,2014494068,Wed Jun 03 01:43:09 PDT 2009,NO_QUERY,JoLinn_,"God i was so happy before i got home, i honestly thought nothing could bring me down. Totally thought wrong. I hate it here "
0,2014494225,Wed Jun 03 01:43:11 PDT 2009,NO_QUERY,louisebolotin,@JohnMarsden Fab thanks!. Have an absolute hangover today tho 
0,2014494258,Wed Jun 03 01:43:12 PDT 2009,NO_QUERY,ElementsOfJazz,"@JoyBailey Wow! No wind? There was a torrential downpour with lightening striking a LOT of stuff, rolling thunder AND gusting 60 mph wind "
0,2014494333,Wed Jun 03 01:43:13 PDT 2009,NO_QUERY,sarahakabmg,"My face got sunburned yesterday, Chris keeps making fun of my red nose "
0,2014494591,Wed Jun 03 01:43:16 PDT 2009,NO_QUERY,alyrunner950,Since I didn't get my grade.    I am going to get some crawfish.
0,2014494680,Wed Jun 03 01:43:17 PDT 2009,NO_QUERY,jamielovez420,@OneLovelyLibra wow you tweet alot O.O please sloooow down i think i got like 100 updates from you alone 
0,2014494686,Wed Jun 03 01:43:17 PDT 2009,NO_QUERY,Niaccurshi,"Bollocks, what's all this &quot;chance of rain next week&quot; rubbish "
0,2014494688,Wed Jun 03 01:43:17 PDT 2009,NO_QUERY,emzypiex,"No toast so tried eating porridge, big mistake  my tummy does not like."
0,2014495098,Wed Jun 03 01:43:21 PDT 2009,NO_QUERY,bookie_girl,@KikiNowski got some coffee before too stiff to get up and get some.my mom seems sad I wanna leave later 
0,2014495111,Wed Jun 03 01:43:22 PDT 2009,NO_QUERY,_colorbandit,@giannabanzon We should! Every week! Haha. But I hope I still get to see you all even when school starts 
0,2014495554,Wed Jun 03 01:43:28 PDT 2009,NO_QUERY,892300,@jtimberlake NOT available in my country (Switzerland) 
0,2014495577,Wed Jun 03 01:43:28 PDT 2009,NO_QUERY,neurotik_nurse,"@mistyleek kudos on the weight lost. i need to start dieting myself, ugh i'm just now realizing how much i ate when i was drunk earlier "
0,2014495799,Wed Jun 03 01:43:32 PDT 2009,NO_QUERY,HEYHEYCHEST,"i want to go to sleep, but no one in the house is up to turn my light off  so i am stuck... ugh."
0,2014496005,Wed Jun 03 01:43:34 PDT 2009,NO_QUERY,sharonko,out of smokes and broke as a mothafuckerrr 
0,2014496015,Wed Jun 03 01:43:34 PDT 2009,NO_QUERY,jozJa,@Jessicaveronica dude thats sad  its the best footy all year go QLD =P
0,2014496080,Wed Jun 03 01:43:35 PDT 2009,NO_QUERY,curlydena,@bngr aw u should have seen it. pulled my shoe off &amp; all my skin came with it. got compeed plasters on now hoping that helps &amp; shoes off! 
0,2014496121,Wed Jun 03 01:43:36 PDT 2009,NO_QUERY,yuvipanda,"Well, I was hoping to make the new app IronPython compatible too. Oh well "
0,2014496199,Wed Jun 03 01:43:37 PDT 2009,NO_QUERY,heroesnphotoes,will watch Dreamweaver Tutorials instead  to pass the time.
0,2014496458,Wed Jun 03 01:43:40 PDT 2009,NO_QUERY,MissKemi,@paul_steele oh  so u leave me? loool...yes im at work!
0,2014496717,Wed Jun 03 01:43:44 PDT 2009,NO_QUERY,Jenny_Braid,"is goin to be packing today to move out of halls, first year of uni....done! "
0,2014496753,Wed Jun 03 01:43:44 PDT 2009,NO_QUERY,katiemcintosh,"so knackered from the gym, first visit since coming back from holiday "
0,2014496766,Wed Jun 03 01:43:44 PDT 2009,NO_QUERY,Haraldson,I miss my second 24&quot; monitor. This 15.4&quot; MBP monitor just doesn't do the job. 
0,2014497001,Wed Jun 03 01:43:47 PDT 2009,NO_QUERY,g1nce,i'm so pissed off now.... 
0,2014497028,Wed Jun 03 01:43:48 PDT 2009,NO_QUERY,bridd,@DC_Zol ah that ssd would be too small  (need at least 16gb to install osx and have a little space!)
0,2014497261,Wed Jun 03 01:43:51 PDT 2009,NO_QUERY,bodbod,Simply must get some sleep  #E3
0,2014497678,Wed Jun 03 01:43:56 PDT 2009,NO_QUERY,jesssuttanet,haven't had @ replies for a while  love them
0,2014497976,Wed Jun 03 01:44:00 PDT 2009,NO_QUERY,CrazzieAbz,"sitting at home watching  TV  not feeling so good, drinking hot chocolate "
0,2014498220,Wed Jun 03 01:44:03 PDT 2009,NO_QUERY,raquelramosx,dentist today  at 11am ahhhh!!
0,2014498291,Wed Jun 03 01:44:04 PDT 2009,NO_QUERY,DinosaursgoRahh,I wish Erin was still coming over tonight. Or Tracey. I hate being alone sometimes. 
0,2014498300,Wed Jun 03 01:44:04 PDT 2009,NO_QUERY,geerob,en route to wharfie for free pies! looking ahead to wallabies baabaas tho &amp; gutted curly blond tower of ugliness ryan cross is out 
0,2014498516,Wed Jun 03 01:44:06 PDT 2009,NO_QUERY,Alegria21,"This is sad...a new theme but it uses white font so right now, ss, I can't see what I'm typing "
0,2014498842,Wed Jun 03 01:44:10 PDT 2009,NO_QUERY,thatjamesboy,I seem to wake up feeling crap all the time lately 
0,2014498899,Wed Jun 03 01:44:11 PDT 2009,NO_QUERY,kilesa,time of the month. so fucking bloated 
0,2014498995,Wed Jun 03 01:44:13 PDT 2009,NO_QUERY,sanzypie,@gonkyouka oh my god....its really sad....condolences...to the victim of the Air France...huhu its really a very sad news 
0,2014499074,Wed Jun 03 01:44:14 PDT 2009,NO_QUERY,ClareWhite,@clinamen  no. job market awful for really good administrators. been referring all the ones I know to shared backroom idea http://bit. ...
0,2014499358,Wed Jun 03 01:44:17 PDT 2009,NO_QUERY,annaversary,@karyeung me too  shop &amp; eat.. . don't we ALL want that?!?
0,2014499381,Wed Jun 03 01:44:17 PDT 2009,NO_QUERY,martinecajucom,@samboaquino i miss u soo much!!! i'm going to watch 'growing up with baby' and 'gone with the wind' just for you! 
0,2014499424,Wed Jun 03 01:44:18 PDT 2009,NO_QUERY,MetroBoy,arghhh!!!! ive left the tracklisting to last nights show at home  bugger... archive will be up 2morrow now then
0,2014499445,Wed Jun 03 01:44:18 PDT 2009,NO_QUERY,liamgh,"Oh hang on, another screen is telling me I don't - maybe it hasn't come through yet "
0,2014499518,Wed Jun 03 01:44:19 PDT 2009,NO_QUERY,dumbnessarann,@hotcitypop 
0,2014499536,Wed Jun 03 01:44:20 PDT 2009,NO_QUERY,poetikgirl,Back to the reality...  Unfortunately...  I am so sad... And worry about Nickaus  I miss you ;(
0,2014499576,Wed Jun 03 01:44:20 PDT 2009,NO_QUERY,PretyGandhi,sulking in office 
0,2014499581,Wed Jun 03 01:44:21 PDT 2009,NO_QUERY,FourMee,It ain't a good morning when you're woken up to a headache! must sleep..can't sleep 
0,2014499587,Wed Jun 03 01:44:20 PDT 2009,NO_QUERY,dyersituation,Wasnt as satisfied with Walle as I would of liked to be. 
0,2014499643,Wed Jun 03 01:44:22 PDT 2009,NO_QUERY,GColdplay,"@ school, weather is the not as good as it was yesterday...  Have to watch the MTV awards on the web I think... xoxo"
0,2014499775,Wed Jun 03 01:44:23 PDT 2009,NO_QUERY,RealChazJastes,@ChazziShae damn girl! It will pay off tho! I wish I would have stayed in school I would be graduating!  going back in aug tho yayayaya!
0,2014499948,Wed Jun 03 01:44:25 PDT 2009,NO_QUERY,ooipau,Why all the negativity from Adam's fans over Drake? Sadness 
0,2014500509,Wed Jun 03 01:44:31 PDT 2009,NO_QUERY,ilsamykins,omg so much freakn homework ! when will teachers figure out that WE DO NOT LIKE HOMEWORK ! 
0,2014500512,Wed Jun 03 01:44:32 PDT 2009,NO_QUERY,frainaa,I hate thunderstorms 
0,2014500524,Wed Jun 03 01:44:32 PDT 2009,NO_QUERY,mischief75,crazy past few days... my brain is feeling recharge after a good dose of Hay festivalness...not happy the sun is going to bugger off soon 
0,2014500569,Wed Jun 03 01:44:32 PDT 2009,NO_QUERY,QueenBxoxo,@xbllygbsn woo ;). awwh okay..so its really... 5.10pm our time O.O oh god :$ thanks donkey years of flying  lol :$. a've no gone longer
0,2014500594,Wed Jun 03 01:44:33 PDT 2009,NO_QUERY,Jayme1988,@Chad_Lad sushi does sound and look good though! not a bar close to us 
0,2014500781,Wed Jun 03 01:44:35 PDT 2009,NO_QUERY,sbrunnen,"Took me an hour to get home, half that time just waiting or a friggin bus. It was supposed to be my early day too "
0,2014500821,Wed Jun 03 01:44:35 PDT 2009,NO_QUERY,aussieboby,I more drop the home-why are people booking jobs so late 
0,2014500858,Wed Jun 03 01:44:36 PDT 2009,NO_QUERY,LucyAnnabel,@Thea_Smith I do feel very lucky &amp; make sure I remember that when I'm sitting by the sea! Shame I have to leave on friday to go back home 
0,2014500903,Wed Jun 03 01:44:36 PDT 2009,NO_QUERY,navyaircrewman,Annoying...was awakened by loud beeping. CO2 alarm is fine. No fire...was two loud beeps. Can't get back to sleep now. 
0,2014501583,Wed Jun 03 01:44:45 PDT 2009,NO_QUERY,barbieprincess,"I'm really tired today, my stoma is over active &amp; I've been up all night going to the bathroom. I'm not a happy bunny "
0,2014501916,Wed Jun 03 01:44:50 PDT 2009,NO_QUERY,cloverdash,No nice dreams about TV presenters last night  But I do recall a big ship &amp; a lightbulb that had neon pink fish inside it. Very strange.
0,2014502050,Wed Jun 03 01:44:52 PDT 2009,NO_QUERY,MissLyssBetch,Yeah loml 
0,2014502108,Wed Jun 03 01:44:55 PDT 2009,NO_QUERY,Nutamu,Going to miss Transformers2 by a few days when I head to Montreal on the 17th. Brilliant timing. The lull between good flicks continues. 
0,2014502251,Wed Jun 03 01:44:55 PDT 2009,NO_QUERY,brettmirl,@donalskehan Cloudy in the sprawling metropolis of Ashbourne too  It was lovely and sunny till about 7.30.
0,2014502552,Wed Jun 03 01:44:59 PDT 2009,NO_QUERY,orgazm20,@_rosieCAKES around here... lol eventhough i got accepted to school in troy im gunna stay in my area for now... 
0,2014502630,Wed Jun 03 01:45:00 PDT 2009,NO_QUERY,jenchappp36,it's way too early to be heading to work. 
0,2014503325,Wed Jun 03 01:45:06 PDT 2009,NO_QUERY,KayTyler,Geography this week &amp; doesn't feel prepared for this one!  Any child psychologists out there - what should I say? 
0,2014503356,Wed Jun 03 01:45:07 PDT 2009,NO_QUERY,drumfil,@jcadditive  120 notes!!!  serious??!!   f**k me.....   
0,2014503440,Wed Jun 03 01:45:07 PDT 2009,NO_QUERY,Mistic_Morgue,@tophatdog Yeah Im glad Conan is back. I missed him 
0,2014504055,Wed Jun 03 01:45:14 PDT 2009,NO_QUERY,PaigeDorans,@spencerpratt @heidimontag Why did you leave?! You two were the only reason i watched the show! No there is no one good left to watch! 
0,2014504101,Wed Jun 03 01:45:15 PDT 2009,NO_QUERY,IAmDala,I have a celeb crushhhh.....but she doesn't even kno 
0,2014504229,Wed Jun 03 01:45:16 PDT 2009,NO_QUERY,klodet,its raining like crazy here in manila. traffic's bound to be super horrible again. sigh... what i wouldnt do to stay all day in bed. 
0,2014504538,Wed Jun 03 01:45:19 PDT 2009,NO_QUERY,misslookather82,gotting caught up on the hills...now time to get ready for wrk   sho cnt wait for this wrk day to be over....cum on 1115am!!!!!!!!!!!!!!!!
0,2014504799,Wed Jun 03 01:45:22 PDT 2009,NO_QUERY,sweetsheilx,I need to study for my science exam tomorrow 
0,2014505100,Wed Jun 03 01:45:26 PDT 2009,NO_QUERY,chaoticcalm,"900 words down, only 2100 to go...although I think I am going to be way over the word count so there will have to be some trimming later "
0,2014505140,Wed Jun 03 01:45:26 PDT 2009,NO_QUERY,icaloveskittles,"so sad, my friend is a repeater this year  why? "
0,2014505165,Wed Jun 03 01:45:26 PDT 2009,NO_QUERY,justinpirie,@Kasia_S That link you just posted on how e-commerce saved our business doesn't work 
0,2014506079,Wed Jun 03 01:45:37 PDT 2009,NO_QUERY,gina_pina_14,could watch their game against Valencia. Wow. That's ¬£3.99 I'm never going to get back. I don't even think Valencia won 
0,2014506399,Wed Jun 03 01:45:40 PDT 2009,NO_QUERY,jshmrsn,Well first day of E3 was amazing. Looking forward to another! Really really sad  I missed live TRS though 
0,2014506952,Wed Jun 03 01:45:46 PDT 2009,NO_QUERY,inomero,Hmph. &quot;The Port&quot; is not happening  Everyone's too full.
0,2014507208,Wed Jun 03 01:45:49 PDT 2009,NO_QUERY,coop925,Getting ready to take G to the hospital... today's the day she gets tubes in her ears...  She's going to be ... http://plurk.com/p/y2z2a
0,2014507276,Wed Jun 03 01:45:50 PDT 2009,NO_QUERY,Ingridcat,Simply must get some sleep  #E3 http://bit.ly/j3ka8c
0,2014507368,Wed Jun 03 01:45:51 PDT 2009,NO_QUERY,violetbakes,@Retrochick_uk ... see some really horrible things people have donated 
