0,2014346937,Wed Jun 03 01:13:41 PDT 2009,NO_QUERY,ErikaSoriano,She's back.and I  don't know what to do. 
0,2014347009,Wed Jun 03 01:13:42 PDT 2009,NO_QUERY,letsgohippo,"Fuck, hurry up "
0,2014347449,Wed Jun 03 01:13:48 PDT 2009,NO_QUERY,nkb1982,"I know it's Origin night tonight and I should be a buzz, but I'm kinda not caring so much  gonna go watch Russell on my iPod I think"
0,2014347512,Wed Jun 03 01:13:49 PDT 2009,NO_QUERY,leecpfc,Damn my back hurts. Think I've done something serious 
0,2014348296,Wed Jun 03 01:13:58 PDT 2009,NO_QUERY,lina_luka,can't believe that time won't pass today. 
0,2014349556,Wed Jun 03 01:14:12 PDT 2009,NO_QUERY,GaryLake,@phil_btt far too much singletrack on the course coupled with far too many fast team racers = bad idea on the ipod front... 
0,2014349641,Wed Jun 03 01:14:13 PDT 2009,NO_QUERY,franalations,@enriqz same here dude.. but it happens all the time 
0,2014349805,Wed Jun 03 01:14:15 PDT 2009,NO_QUERY,hulucrafts,Scanning Sublime yarn shade cards for a customer.  Sirdar don't do shade cards that people can buy 
0,2014349922,Wed Jun 03 01:14:16 PDT 2009,NO_QUERY,LavaLampLilly,@Marshmelowsquid Christaaaaaa!! Science is hurting my heads!!! 
0,2014350268,Wed Jun 03 01:14:20 PDT 2009,NO_QUERY,kimmiherlihy,Another Beautiful Day In Ireland! Got Burnt A Bit Yesterday!  x
0,2014350318,Wed Jun 03 01:14:21 PDT 2009,NO_QUERY,only1sweetmaddy,@mpriest77 Johnny mad at me cause I used 10 bucks off his debit card  fucking bastard! Said he was going to get me evicted
0,2014350438,Wed Jun 03 01:14:22 PDT 2009,NO_QUERY,Graftacus,has had better days off   Back to work now though ;-))
0,2014350526,Wed Jun 03 01:14:23 PDT 2009,NO_QUERY,jagregory,using (var me = new James()) { james.DoWork(); } // I'm disposable 
0,2014350628,Wed Jun 03 01:14:24 PDT 2009,NO_QUERY,kateluvs30stm,i got my hair curled today looked good until now it all fell out bummer!! 
0,2014350899,Wed Jun 03 01:14:27 PDT 2009,NO_QUERY,ferngully88,@Paulinasaur it's hot over here 
0,2014351034,Wed Jun 03 01:14:29 PDT 2009,NO_QUERY,TweetTitha,"imucu mr. andreas, mr. gus, eca, rifky, avip, oksa, harits, diaz, and all my friends @ LIA huuuu "
0,2014352320,Wed Jun 03 01:14:45 PDT 2009,NO_QUERY,dmi,"Sitting in the office, feels like I'm getting hay fever of some sort.  #fb"
0,2014352418,Wed Jun 03 01:14:47 PDT 2009,NO_QUERY,emmacourtney85,@scholesy111 Didn't go last night  Boo! Went to cinema instead - I will win next time tho!
0,2014352485,Wed Jun 03 01:14:48 PDT 2009,NO_QUERY,elizabethlai,today's history tutorial somehow works a little. and i also realise that i didnt have my lunch and breakfast.  i'm feeling super hungry nw
0,2014352576,Wed Jun 03 01:14:49 PDT 2009,NO_QUERY,shonypanjikaran,Changing the plan for X Men for the nth time! 
0,2014352605,Wed Jun 03 01:14:50 PDT 2009,NO_QUERY,appleapple_,"@willomatic I know, I am weak  but it's okay, I only drink with you guys."
0,2014352679,Wed Jun 03 01:14:51 PDT 2009,NO_QUERY,zym_04,the classes have been suspended.. too bad my classes aren't  
0,2014352742,Wed Jun 03 01:14:52 PDT 2009,NO_QUERY,jagregory,using (var me = new James()) { james.DoWork(); } // I'm disposable  #meCode
0,2014352776,Wed Jun 03 01:14:52 PDT 2009,NO_QUERY,setasimoni,my followers are going down 
0,2014353422,Wed Jun 03 01:14:59 PDT 2009,NO_QUERY,HeSoAmazin,@Andrea_Reneee plane ticket silly...I wanna see my babeboo  lol
0,2014353595,Wed Jun 03 01:15:01 PDT 2009,NO_QUERY,Danielleypoo1,"@ilovethelword haha, yeah.. &quot; you're the robot!&quot; did it do it again? Yeah, I know it sucks! "
0,2014353951,Wed Jun 03 01:15:04 PDT 2009,NO_QUERY,itsmariapeace,@ddlovato aww I love demi lovato; and doesnt it just suck that ppl that say mean things get replys'  but me who LOVES this kid cant get 1
0,2014354004,Wed Jun 03 01:15:05 PDT 2009,NO_QUERY,Ps8612,@mousebudden ur mod frydude is WACK! I've been online w/u since this morning &amp; he kickd me out! 
0,2014354088,Wed Jun 03 01:15:06 PDT 2009,NO_QUERY,sscullion,"buenos dias tweeps, I'm struggling with alergies today, feeling yucky "
0,2014354494,Wed Jun 03 01:15:10 PDT 2009,NO_QUERY,staceycmparker,"@elaineewing I love black hair.  Even if I had a mohawk, I wouldn't be intimidating to anybody. "
0,2014354537,Wed Jun 03 01:15:10 PDT 2009,NO_QUERY,JaneDoe808,@CherrybombPk Yeah very... 
0,2014354714,Wed Jun 03 01:15:12 PDT 2009,NO_QUERY,CarolynTD,"@KirstieBxo soz, lost internet connection yesterday  i've nt bin up to much lol jst revisin.. you gt anything planned for the summer?"
0,2014355217,Wed Jun 03 01:15:17 PDT 2009,NO_QUERY,kikisfishy,Day off work and the suns gone  http://myloc.me/2rLT
0,2014355423,Wed Jun 03 01:15:20 PDT 2009,NO_QUERY,chaaarmainec,"I'm really missing you, @DoChickensTweet. "
0,2014355793,Wed Jun 03 01:15:25 PDT 2009,NO_QUERY,LittleMissBob,Whaa. Just woke up and put glasses on and they feel really oddly heavy on my schnoss 
0,2014355892,Wed Jun 03 01:15:26 PDT 2009,NO_QUERY,R0zee,A tree branch flew into my kitchen window.  After watching S. Darko I'm a little creeped out!  And this is my 800th tweet 
0,2014356127,Wed Jun 03 01:15:28 PDT 2009,NO_QUERY,sonjamartin,hunger temporarily fixed. still totally tired. need something to cuddle with.. where the hell did Rupert go?? 
0,2014356457,Wed Jun 03 01:15:33 PDT 2009,NO_QUERY,michellefabio,"@ThornesWorld Unfortunately today's a rainy day so playing and swimming aren't options...my allergies are acting up too  Anyhoo, onward!"
0,2014356825,Wed Jun 03 01:15:38 PDT 2009,NO_QUERY,ashtew,why do i exactly start feeling hungry the moment i decide not to order lunch and others have already placed there orders 
0,2014356921,Wed Jun 03 01:15:38 PDT 2009,NO_QUERY,russgroves,"dissapointed with the nintendo and Playstation e3 keynote  - actually i'm lying, i'm pleased they were so bad"
0,2014357188,Wed Jun 03 01:15:42 PDT 2009,NO_QUERY,TraytablesTrvls,"thinks people who say #AF447 is like 'LOST&quot; need to get a life. Those were actors, we're talking REAL people lost at sea "
0,2014357251,Wed Jun 03 01:15:42 PDT 2009,NO_QUERY,jmbatchelor,@mattdearden I know the feeling... 
0,2014357296,Wed Jun 03 01:15:43 PDT 2009,NO_QUERY,ShikhaBirdie,My little sister wnt 2 Pune 4 her job 2day. Mum cried as if she got married! Im gonna miss our khit pit and cat fight over clothes..  #fb
0,2014357486,Wed Jun 03 01:15:45 PDT 2009,NO_QUERY,Daphneew7,"2 weeks hols? Ugh, need some help here. Dying of boredom "
0,2014357591,Wed Jun 03 01:15:46 PDT 2009,NO_QUERY,iviarlue,Lonely   
0,2014357684,Wed Jun 03 01:15:48 PDT 2009,NO_QUERY,star_scapes,"Craving new ink so badly, its been too long "
0,2014357714,Wed Jun 03 01:15:48 PDT 2009,NO_QUERY,kkimberlyyy,I'm sorry if I'm overreacting on things lately but it's just that you haven't been much of a friend these days...  Sorrryyyy
0,2014357900,Wed Jun 03 01:15:50 PDT 2009,NO_QUERY,triciaruth,It is beautifully hot weather for a day atthe beach. Unfortunately I'm at work in a hot-making uniform 
0,2014357925,Wed Jun 03 01:15:50 PDT 2009,NO_QUERY,Ducer15,@MaKUltra Thanks. May have a look if I get time. 
0,2014358283,Wed Jun 03 01:15:55 PDT 2009,NO_QUERY,procphil,@lyndanicely Found you through @MrTweet. Sorry - I normally always follow back so not sure how I missed you 
0,2014358557,Wed Jun 03 01:16:00 PDT 2009,NO_QUERY,iPhoneMe,"Hmm, the carrier is too hard   #flightcontrol"
0,2014359048,Wed Jun 03 01:16:04 PDT 2009,NO_QUERY,lilemawee,no one is on msn 
0,2014359886,Wed Jun 03 01:16:12 PDT 2009,NO_QUERY,geniusparadox,is making cash money.. NOT! 
0,2014359932,Wed Jun 03 01:16:13 PDT 2009,NO_QUERY,lisamwiseman,can anyone recommend a twitter client for mac tiger 10.4? tweetie only works on 10.5 
0,2014360041,Wed Jun 03 01:16:14 PDT 2009,NO_QUERY,ViciousPotato,"@rileyclarkson Oh, it's awful! To make matters worse, half the time I just leave it as is. "
0,2014360092,Wed Jun 03 01:16:15 PDT 2009,NO_QUERY,BohemianScandal,"Why I always emerse myself in old things when I'm depressed I will never know. I need to write so bad, but I have to sleep. "
0,2014360157,Wed Jun 03 01:16:16 PDT 2009,NO_QUERY,marinalynn,can i be done with spanish already?  i wish i was better at it... but living in germany messed up my grammar more than i thought it did!
0,2014360992,Wed Jun 03 01:16:25 PDT 2009,NO_QUERY,iwishiwas,can i be done with spanish already?  i wish i was better at it... but living in germany messed up my grammar m.. http://tinyurl.com/q6kynx
0,2014361461,Wed Jun 03 01:16:30 PDT 2009,NO_QUERY,Bdazzld,Wish I could attend E3 or send E or Jenn for a half day  but reports and moving wait for no show. &gt;.&lt;
0,2014361715,Wed Jun 03 01:16:34 PDT 2009,NO_QUERY,jckelou,"Thinking about changing my major. Fck man. This is so frustrating. Accounting, maybe? Idk. "
0,2014361959,Wed Jun 03 01:16:37 PDT 2009,NO_QUERY,EdmondEgan,"Someone has jumped off the bridge on the parkway, doesn't look good as  they have been laid in the road for 10 mins covered up. "
0,2014362235,Wed Jun 03 01:16:40 PDT 2009,NO_QUERY,ankita_gaba,@ShikhaBirdie my mom went for a job to delhi yesterday....i cried thw whole weeken...everytime door bell rings i think its her 
0,2014362336,Wed Jun 03 01:16:41 PDT 2009,NO_QUERY,kylemayne,ARH! How do you rotate a table in Word 2007? I firmly believe it can't be done 
0,2014362730,Wed Jun 03 01:16:46 PDT 2009,NO_QUERY,BrokenStruggle,"@Ashcoates bad nights sleep cud also be attributed my stubborness to change winter-summer quilt, caved in this morning tho "
0,2014363158,Wed Jun 03 01:16:52 PDT 2009,NO_QUERY,mzChinadoLL,im goin to sleep this is too much for me im really going to cry 
0,2014363330,Wed Jun 03 01:16:54 PDT 2009,NO_QUERY,migaruler,Twitter is so quiet today 
0,2014363751,Wed Jun 03 01:16:59 PDT 2009,NO_QUERY,tim_cooke,@cocotteloup ahaha i know! 
0,2014363776,Wed Jun 03 01:16:59 PDT 2009,NO_QUERY,MissLyssBetch,Tomyss  why?!! Did u crushem with yo thunda thighz?!
0,2014364050,Wed Jun 03 01:17:02 PDT 2009,NO_QUERY,iLadySyncere,@JniceLOVE Damnit I spoke 2 soon.  they went after me. [the feline bots] lol
0,2014364168,Wed Jun 03 01:17:04 PDT 2009,NO_QUERY,StephCyrus09,"@RockinChick09 But he said whose your cuzzin steph wierd,,,,, lol Oyy maybe im mad i wanna talk to her  lol"
0,2014365179,Wed Jun 03 01:17:16 PDT 2009,NO_QUERY,AndrewOneDegree,stress this morning. Nothing like an early morning issue to start the day... 
0,2014365262,Wed Jun 03 01:17:17 PDT 2009,NO_QUERY,JeremyTNell,"@frankortmann I know.    I also think it's a bit high.  Hopefully, you'll still come along."
0,2014365877,Wed Jun 03 01:17:24 PDT 2009,NO_QUERY,Jamesashton20,On a stress! not looking forward to today at all!! 
0,2014365891,Wed Jun 03 01:17:24 PDT 2009,NO_QUERY,felingpoh,"i need coffee, some medicine, and hugs. "
0,2014365905,Wed Jun 03 01:17:24 PDT 2009,NO_QUERY,xLisAx93,wheres the sun gone?! oh well im already sunburnt so i dont really need anymore sun 
0,2014366028,Wed Jun 03 01:17:25 PDT 2009,NO_QUERY,jennysunphoto,"@benlimphoto oh u serious? why would they do that?  btw, the attire from the session was all client's choice. They have fab taste! "
0,2014366095,Wed Jun 03 01:17:26 PDT 2009,NO_QUERY,kyelani,@CatatonicCat awww   i'll send you some heinz beans ... my contribution to the cause ;) x
0,2014366131,Wed Jun 03 01:17:27 PDT 2009,NO_QUERY,segalc,I had the most exciting weekend only to be followed by the flu 
0,2014366378,Wed Jun 03 01:17:30 PDT 2009,NO_QUERY,SaveMeCJR,@nicolelovesyou they been wanting to meet u cause i been talking bout u alot cause i miss u like alot 
0,2014366460,Wed Jun 03 01:17:31 PDT 2009,NO_QUERY,MJ1331L,my screen died.  thank god for apple care. hopefully i can get a new screen.
0,2014366518,Wed Jun 03 01:17:32 PDT 2009,NO_QUERY,iheartrachael,@allyXwebb a club? lmao. me and only me love andrew  bumberr
0,2014366668,Wed Jun 03 01:17:34 PDT 2009,NO_QUERY,zhotshotz,"didnt make any shots at ball today, so sad "
0,2014366790,Wed Jun 03 01:17:35 PDT 2009,NO_QUERY,HillsWifey41209,going to try to go to bed 
0,2014366944,Wed Jun 03 01:17:37 PDT 2009,NO_QUERY,xxcarcrashes,get out of my head! 
0,2014368320,Wed Jun 03 01:17:54 PDT 2009,NO_QUERY,ssensibleheart,@kamisoul !!! Yeah I think that was about the time I was heading home from work! 
0,2014368869,Wed Jun 03 01:18:01 PDT 2009,NO_QUERY,Kathyhandis,I'm knackered and it's only 9.20 
0,2014369026,Wed Jun 03 01:18:03 PDT 2009,NO_QUERY,rahulrakesh,@cgiridhar no boss. still trying to locate that 
0,2014369096,Wed Jun 03 01:18:04 PDT 2009,NO_QUERY,missimperfect,"I feel like shit; therefore, I am shit.   I hate feeling this way."
0,2014369222,Wed Jun 03 01:18:05 PDT 2009,NO_QUERY,sakurajewellery,@siobhian oh no honey poo 
0,2014369328,Wed Jun 03 01:18:06 PDT 2009,NO_QUERY,Solitude12,"Sleep tiems! Darn, not 8 hours anymore.... "
0,2014369446,Wed Jun 03 01:18:08 PDT 2009,NO_QUERY,Ben_Candlin,"Successfully logged onto the HSBC website on my phone! ...yep, still no money "
0,2014369480,Wed Jun 03 01:18:08 PDT 2009,NO_QUERY,clozzie,is sick  BOO HOO... what else is there to do on this twitter; any suggestions?
0,2014369498,Wed Jun 03 01:18:09 PDT 2009,NO_QUERY,ChrissieFerrer,doesnt really want to walk home from the gym in the rain 
0,2014369671,Wed Jun 03 01:18:10 PDT 2009,NO_QUERY,glimmerous,@athialis i wish i had some wine 
0,2014369849,Wed Jun 03 01:18:13 PDT 2009,NO_QUERY,JessiJaeJoplin,&quot;jim carey hasn't made me laugh since 1997&quot; 
0,2014369987,Wed Jun 03 01:18:15 PDT 2009,NO_QUERY,allgames,Noo! Worst news of the year   One of the greatest of all time. Lucky to have had the years we did. http://tinyurl.com/qdq434 See you on TV
0,2014370116,Wed Jun 03 01:18:16 PDT 2009,NO_QUERY,fireboy333,1 friend left on the wall take her down pass her around no more friends on the wall.  this is what it feels like with out any friends oyea
0,2014370138,Wed Jun 03 01:18:17 PDT 2009,NO_QUERY,ragdollprincess,aww my sunglasses just broke 
0,2014370167,Wed Jun 03 01:18:17 PDT 2009,NO_QUERY,Imperfectionx3,is not liking how warm it is here 
0,2014370423,Wed Jun 03 01:18:20 PDT 2009,NO_QUERY,dougcoleman,"Dammit, just before Steve Martin and Paul Simon were about to jam on Jimmy Fallon's show, a damn Emergency Alert System test #tvsucks "
0,2014370437,Wed Jun 03 01:18:20 PDT 2009,NO_QUERY,siobhian,Eugh. I hate seeing Mark in pain 
0,2014370516,Wed Jun 03 01:18:20 PDT 2009,NO_QUERY,bluefrez,"Opened the curtains and realised the sunshine has gone, back to cloudy "
0,2014370963,Wed Jun 03 01:18:26 PDT 2009,NO_QUERY,_kotenok,got hit in the eye by something cycling home last night and it's now swollen and sore 
0,2014371262,Wed Jun 03 01:18:29 PDT 2009,NO_QUERY,niinanorthcott,"just got up  its tooo early, and im still red+ my taper keeps coming put :/"
0,2014371349,Wed Jun 03 01:18:30 PDT 2009,NO_QUERY,clauds,@rinaz hehe. do you do it twice? i do  hahaha.
0,2014371367,Wed Jun 03 01:18:31 PDT 2009,NO_QUERY,marie03,@TheScottWeiland its great that STP are touring in 2009 but where are the UK dates!? Please do some shows over here 
0,2014371478,Wed Jun 03 01:18:32 PDT 2009,NO_QUERY,waltstewart,"My phone is all messed up, and I need it desperately for tomorrow, so if you try to get in contact with me i dunno what to do "
0,2014371675,Wed Jun 03 01:18:34 PDT 2009,NO_QUERY,IamIli,I miss Hafiz terribly. 
0,2014371688,Wed Jun 03 01:18:35 PDT 2009,NO_QUERY,Leali_Herzog,Studying german .. ahh I'm so afraid 
0,2014371955,Wed Jun 03 01:18:38 PDT 2009,NO_QUERY,Secretshowcase,@justinmaller Ahh man it's to bad that every wp is maximum 1680x1050  I need some 1920x1200 ones!
0,2014372044,Wed Jun 03 01:18:39 PDT 2009,NO_QUERY,Ashley007,ive never had this much hw to do in a very long time! i dont like it 
0,2014372270,Wed Jun 03 01:18:42 PDT 2009,NO_QUERY,mrskaylajonas,they have sims 3 for itouch(: ! but its 10 dollars..i only have 15 left for itunes and ppl are saying it crashes alot  should i get it?
0,2014372331,Wed Jun 03 01:18:42 PDT 2009,NO_QUERY,elizabethsacco,i hope someone comes to the movies with me to watch adventureland this weekend. all my friends are bailing on me! 
0,2014372420,Wed Jun 03 01:18:44 PDT 2009,NO_QUERY,SubVee,"@starsparkle Aw charming, my 'Rents have just announced they're coming to visit this weekend! Can I get a BBQ doggy bag  Gurr!"
0,2014372528,Wed Jun 03 01:18:45 PDT 2009,NO_QUERY,OmegaMom,"@mimiboo I tried going to your blog, but it's still showing an &quot;account suspended&quot; page!  "
0,2014372654,Wed Jun 03 01:18:47 PDT 2009,NO_QUERY,nicoleyy_x,hands are cold 
0,2014372665,Wed Jun 03 01:18:47 PDT 2009,NO_QUERY,ElenaFernandez3,RIP Crystal 
0,2014373003,Wed Jun 03 01:18:51 PDT 2009,NO_QUERY,Maximilus,@boywonder101 Hey. I was awake  Listen need some help on business law @amisij Explain &quot;consideration must not be past&quot; please
0,2014373032,Wed Jun 03 01:18:52 PDT 2009,NO_QUERY,jachee,"I want at least 2 of todays @woot items... alas, I cannot afford even one.  #damnyourentcheck"
0,2014373203,Wed Jun 03 01:18:53 PDT 2009,NO_QUERY,janine_j9,someone slept on me 
0,2014373584,Wed Jun 03 01:18:58 PDT 2009,NO_QUERY,Desireez,says i'm sorry!  http://plurk.com/p/y2ryu
0,2014373793,Wed Jun 03 01:19:01 PDT 2009,NO_QUERY,dardeile,I kinda miss the Xena series.  Lucy Lawless was fab!
0,2014373796,Wed Jun 03 01:19:01 PDT 2009,NO_QUERY,maddybt,eugh i had to type in my pword like fitybillion times for my hotmail! 
0,2014373877,Wed Jun 03 01:19:02 PDT 2009,NO_QUERY,farttr,www.Farttr.com FartWatch: I farted and it woke me up and it smelled like got sauce but more like poop  http://cli.gs/Ahha6s
0,2014374247,Wed Jun 03 01:19:07 PDT 2009,NO_QUERY,andydunwoodycom,Shutter sticking. Very thin white stripe down side of image. Can't get it serviced until after fort bill. Backup camera nailed too 
0,2014375017,Wed Jun 03 01:19:17 PDT 2009,NO_QUERY,janine_j9,someone fell asleep on me 
0,2014375146,Wed Jun 03 01:19:18 PDT 2009,NO_QUERY,Danisidhe,Oh and it's for a WIn PC or else I wouldn't need help - all the help refers to Apple keyboards only 
0,2014375265,Wed Jun 03 01:19:20 PDT 2009,NO_QUERY,kat_n,@_hayles hey lovely!! hows you?not on long just bout to head off.got stuff to do  .our suns away today   xxx
0,2014375283,Wed Jun 03 01:19:20 PDT 2009,NO_QUERY,Xantiriad,@Mideon It is a sore point. GAME sent it on 26/5 and it hasn't turned up yet. I've been on their case this morning. 
0,2014375380,Wed Jun 03 01:19:21 PDT 2009,NO_QUERY,nicoleffoster,i want my iphone!  stupid insurance people should've sent it back already!
0,2014375804,Wed Jun 03 01:19:26 PDT 2009,NO_QUERY,masonicboomk8,"Just goes to show, pick your heroes wisely. "
0,2014376064,Wed Jun 03 01:19:29 PDT 2009,NO_QUERY,mo3ath,So I woke up and the bell is ringing turn out its 3omaal for the washer :S malii 5lghom 
0,2014376530,Wed Jun 03 01:19:36 PDT 2009,NO_QUERY,Carto,"Fudge is lot better and less stressed, but I'm still worrying about him.   He's not eaten at all so far today "
0,2014376643,Wed Jun 03 01:19:37 PDT 2009,NO_QUERY,astropixie,temperature dropped 12 degrees celsius overnight   goodbye sun.   goodbye summer.
0,2014376686,Wed Jun 03 01:19:38 PDT 2009,NO_QUERY,bushido02,@teapartynews Yea..I know...momentary lapse of reason...   #tcot #ac2c #hhrs #912 #sgp #tlot #gwot #nra #gop #rush #teapar
0,2014376850,Wed Jun 03 01:19:39 PDT 2009,NO_QUERY,reese23,Note to all bi(or more)lingual people: I hate you. 
0,2014376999,Wed Jun 03 01:19:41 PDT 2009,NO_QUERY,_Haylzcool_,@WebAsh your a meany 
0,2014377212,Wed Jun 03 01:19:44 PDT 2009,NO_QUERY,rosejblover,"Hey @jonasbrothers *type your question here* #jonasliveonfbCan you do the live chat earlier? I can't be there, because it's at night then "
0,2014377230,Wed Jun 03 01:19:44 PDT 2009,NO_QUERY,cyberiagirl,is sad to say goodbye to her mum and sister so soon. 
0,2014377292,Wed Jun 03 01:19:45 PDT 2009,NO_QUERY,drewxsunshine,"just started a war with the stomach: cottage cheese on wheat things, kenpo + ab ripper x, protein shake, tater tots, and now red wine.. "
0,2014377339,Wed Jun 03 01:19:45 PDT 2009,NO_QUERY,Acillatem07,.........................There may be trouble ahead 
0,2014377420,Wed Jun 03 01:19:47 PDT 2009,NO_QUERY,steevc,Can't seem to change some File Associations in !Kubuntu. When I press Apply they revert. Don't want Audacity as default for MP3 
0,2014377437,Wed Jun 03 01:19:47 PDT 2009,NO_QUERY,laaaaaaneee,@msbaraja yea I did today but I haven't listened to it yet  lol r u gonna see them again?
0,2014377959,Wed Jun 03 01:19:53 PDT 2009,NO_QUERY,zuppalizzle,...And wtf carpathian?! no shows in Newcastle or Sydney? I miss you. 
0,2014378119,Wed Jun 03 01:19:55 PDT 2009,NO_QUERY,kylebeattie09,"morning everyone, getting ready for school and then going to get the bus. I have a spanish exam today  SHIT!!!!"
0,2014378159,Wed Jun 03 01:19:56 PDT 2009,NO_QUERY,Silkjaer,http://browserlab.adobe.com/ This is really awesome! Kudos Adobe! Love the onion skin mode - miss some browsers though  #Browserlab
0,2014378724,Wed Jun 03 01:20:02 PDT 2009,NO_QUERY,teephanee09,@cheonea i am beyond words jealous 
0,2014379019,Wed Jun 03 01:20:05 PDT 2009,NO_QUERY,ionaaaa,oow think i pulled a muscle in my tummy after all those sit ups i did yesterday. Dammit! 
0,2014379143,Wed Jun 03 01:20:06 PDT 2009,NO_QUERY,thatkidjames,@gurl4equality   *sends love your way*
0,2014379322,Wed Jun 03 01:20:08 PDT 2009,NO_QUERY,Marita_A,Headache getting worse 
0,2014379369,Wed Jun 03 01:20:08 PDT 2009,NO_QUERY,miss_missy09,@mileycyrus can you follow me please just so  have someone 
0,2014379424,Wed Jun 03 01:20:09 PDT 2009,NO_QUERY,Banaalne,"I'm touching Kedsu's laptop (WOW, that's a huge surprise that she lets me use it). Anyway, going to the dentist today. "
0,2014379691,Wed Jun 03 01:20:11 PDT 2009,NO_QUERY,8carl8,@MonaDeFleur I really wanna see it too I heard it's good but again no one wanna see it with me 
0,2014379739,Wed Jun 03 01:20:12 PDT 2009,NO_QUERY,dansterdavid,@sweetsheilx Yay congrats. School for me is gonna start on Monday. Boooooooo. 
0,2014380120,Wed Jun 03 01:20:16 PDT 2009,NO_QUERY,angeelinaj,argh !! school tommrow 
0,2014380320,Wed Jun 03 01:20:19 PDT 2009,NO_QUERY,Jane_Paris,"@clawang AJ is not from HK  &quot;when it's too good to be true, it probably is.&quot;"
0,2014380455,Wed Jun 03 01:20:20 PDT 2009,NO_QUERY,triggerhappy,"@garry1bowie not as bad, but I woke up thinking it was Thurs "
0,2014380731,Wed Jun 03 01:20:24 PDT 2009,NO_QUERY,jemmarichardson,Tech . .  Yuk . . in and out its the way 2 do it =D
0,2014380887,Wed Jun 03 01:20:25 PDT 2009,NO_QUERY,ohlibby,i miss my friends here. why are they all spread out across the globe 
0,2014381161,Wed Jun 03 01:20:27 PDT 2009,NO_QUERY,matayp,today i will be having a sad day  
0,2014381294,Wed Jun 03 01:20:29 PDT 2009,NO_QUERY,CSSuperstar,work...........................eurrrrgh! 
0,2014381554,Wed Jun 03 01:20:31 PDT 2009,NO_QUERY,TonniePodRobot,Mmm..Buttertoast  I wanna see @ElectroAnna @EDANIELLE @ravegabe @liamadrid tomorrow  GAAAH!
0,2014382309,Wed Jun 03 01:20:40 PDT 2009,NO_QUERY,gilbosh,A cup of tea is in order....and more lemsip 
0,2014382416,Wed Jun 03 01:20:41 PDT 2009,NO_QUERY,timebenezer,At CAPgemini in Aston - what a grey day too 
0,2014382424,Wed Jun 03 01:20:41 PDT 2009,NO_QUERY,ashleighptaylor,feels the need to drink a large amount of alcohol this weekend. dam every1 having mid years 
0,2014382702,Wed Jun 03 01:20:44 PDT 2009,NO_QUERY,evan_a,waiting... 
0,2014383063,Wed Jun 03 01:20:49 PDT 2009,NO_QUERY,beautyfake,doesn't know what else to delete to get that extra 3GB. 
0,2014383064,Wed Jun 03 01:20:49 PDT 2009,NO_QUERY,SgtBilbo,Had to park a million miles from work 
0,2014383158,Wed Jun 03 01:20:50 PDT 2009,NO_QUERY,awendyy,cleaned up the new house plus aircon &amp; blinds are installed! can't wait till moving day! i have a wood splint(sp) in my thumb. it hurts! 
0,2014383286,Wed Jun 03 01:20:51 PDT 2009,NO_QUERY,scottindeed,My Name Is Earl is cancelled. 
0,2014383721,Wed Jun 03 01:20:57 PDT 2009,NO_QUERY,punchdouble,pretty much finished Sims3 within a day 
0,2014383983,Wed Jun 03 01:21:00 PDT 2009,NO_QUERY,grettel182,@metalero 12 episodes in and I''m still not hooked. It's not looking good 
0,2014384505,Wed Jun 03 01:21:06 PDT 2009,NO_QUERY,Joesmam,would take me 20 mins to get my baby sorted then get a bus....another 20 mins.... my other half works in stockton but wont go to get him 
0,2014384621,Wed Jun 03 01:21:07 PDT 2009,NO_QUERY,TaraBusch,Last day in UK.  Going to Roath park w/ maf with a picnic &amp; to look for a house. Did I say that so loudly?
0,2014384863,Wed Jun 03 01:21:10 PDT 2009,NO_QUERY,teephanee09,3grand time &amp; people. stop me from fulfilling a wish  sigh
0,2014385097,Wed Jun 03 01:21:13 PDT 2009,NO_QUERY,atomic811,@magicswebpage I am sorry to hear that 
0,2014385147,Wed Jun 03 01:21:13 PDT 2009,NO_QUERY,zeros_and_ones,@helllittleangel -hate being in that club. Mosquito has kept me up all night long  -This means Sun Tzu!
0,2014385292,Wed Jun 03 01:21:15 PDT 2009,NO_QUERY,mZ_mC_l0vN,oh yes its about to be a thunderstorm at 4am in nj... real sexy!!! mr.show0ff where u at babes??!!! 
0,2014385825,Wed Jun 03 01:21:22 PDT 2009,NO_QUERY,bibyen,says GRABE guys! Ang ganda nung theme nung debut ni ate! (woot) kaso meron ba sya?  http://plurk.com/p/y2sl1
0,2014385896,Wed Jun 03 01:21:23 PDT 2009,NO_QUERY,nuurajeerah,is off to airport sending bryan  takecare my friend. sigh 'LETS DRINK TONIGHT!!!!'
0,2014386142,Wed Jun 03 01:21:25 PDT 2009,NO_QUERY,xbllygbsnii," thats a shame but as soon as a plane loses contact with the airports &amp; doesnt emergency land within hours, obv something bads happened :$"
0,2014386502,Wed Jun 03 01:21:30 PDT 2009,NO_QUERY,mellisalamay,weird.. i just really really reallllyyyyyyy sleepy all of a sudden... i dont want to be tired yet. 
