0,2014625336,Wed Jun 03 02:09:00 PDT 2009,NO_QUERY,Elliecopter_,back on it got caught and came back off  im a bloody mess!
0,2014625781,Wed Jun 03 02:09:04 PDT 2009,NO_QUERY,squiishee,Omg I'm scared  so much rumbling!
0,2014626315,Wed Jun 03 02:09:10 PDT 2009,NO_QUERY,Kimber1985,Im wondering if i could use Twitter to find a Date? a Friend? as im not having too much luck in the real world 
0,2014626502,Wed Jun 03 02:09:13 PDT 2009,NO_QUERY,Rickweasel,OK I give up.  I will ask my uncle for help. I just hope hes up for a challenge. I AM FAIL.  
0,2014626763,Wed Jun 03 02:09:16 PDT 2009,NO_QUERY,monnie,"@Jase88 I would have come last night too, but I can't even get out of bed  Have a good time!"
0,2014626949,Wed Jun 03 02:09:18 PDT 2009,NO_QUERY,iSlayer2009,@smudge372 you ok sicknote?! Don't like to see you unwell 
0,2014627301,Wed Jun 03 02:09:22 PDT 2009,NO_QUERY,wendychou, i got scolded by my mother via skype. told me to go to sleep. doesn't she know by now that her daughter is nocturnal.
0,2014628103,Wed Jun 03 02:09:31 PDT 2009,NO_QUERY,Catocalypse_Now,Got woken up by thunder must go back to bed 
0,2014628178,Wed Jun 03 02:09:32 PDT 2009,NO_QUERY,gavreilly,Shit. Totally thought today was June 2nd. 
0,2014628185,Wed Jun 03 02:09:32 PDT 2009,NO_QUERY,CorCorjdore,@OscarAlexanderX u and me both  http://myloc.me/2rRl
0,2014628322,Wed Jun 03 02:09:34 PDT 2009,NO_QUERY,iSlayer2009,@pete_c am I not chubb any more then? 
0,2014628469,Wed Jun 03 02:09:36 PDT 2009,NO_QUERY,rippleali,"@nataschamirosch love it, but havent' been there in over a year, so much great stuff here that i forget about "
0,2014628563,Wed Jun 03 02:09:37 PDT 2009,NO_QUERY,JRDM,"1st one came out on 3rd attempt, but 2nd eyechip just won't budge "
0,2014628853,Wed Jun 03 02:09:41 PDT 2009,NO_QUERY,kkimberlyyy,T-1 I MISS YOU SO MUCH.  Why can't T-1 be our class instead??
0,2014629335,Wed Jun 03 02:09:47 PDT 2009,NO_QUERY,jostar1988,In college with the awesome nimz! no one else is in  get following people!! big exam tomorrow xx
0,2014629336,Wed Jun 03 02:09:47 PDT 2009,NO_QUERY,Shaundrie,Barnacles!!!! All these channels and aint ish on! Guess I will watch Lilo n Stitch 
0,2014629444,Wed Jun 03 02:09:49 PDT 2009,NO_QUERY,yanbe,"Seemic Desktop seems nice. But it doesn't support input method on my environment (Linux, ATOK) "
0,2014629544,Wed Jun 03 02:09:50 PDT 2009,NO_QUERY,Impala_Guy,checked twitter yesterday 20.00 - ye missed each other again 
0,2014629637,Wed Jun 03 02:09:51 PDT 2009,NO_QUERY,adwaitp,Got the BrainBone daily question wrong!  - http://bit.ly/HNCiS
0,2014629715,Wed Jun 03 02:09:52 PDT 2009,NO_QUERY,Smophs,"@maaaarit it was horrible, I kept holding up all the traffic, so embarrassing "
0,2014629787,Wed Jun 03 02:09:53 PDT 2009,NO_QUERY,ElsKe777,@DonnieWahlberg STOP saying how insane this tour is gonna be ... It's driving me crazy that I can't make it to the US to see a show! 
0,2014630051,Wed Jun 03 02:09:56 PDT 2009,NO_QUERY,thepetshopboy,goodbye grandma...despite my tears i know u're in a better place...u'll always be the love of my life. i miss u  ‚ô´ http://blip.fm/~7jmed
0,2014630052,Wed Jun 03 02:09:56 PDT 2009,NO_QUERY,alzombievampire,I didn't even take a long enough nap to warrent this up all night he**  gotta hit up the double brew when I get to the crack house.
0,2014630056,Wed Jun 03 02:09:56 PDT 2009,NO_QUERY,MsDia,"@Kingarthur1079 Awe man, we got ta talking &amp; neglected the music.  Great Convo tho"
0,2014630170,Wed Jun 03 02:09:58 PDT 2009,NO_QUERY,ShadyAlgorithms,Feeling really sick. Not sure as to why but hopefully I'll feel better when I wake up. 
0,2014630241,Wed Jun 03 02:09:59 PDT 2009,NO_QUERY,petraaafied,hated the velocity one as well. ARGH. let's just say that i NEED full marks on friday. yeaaah 
0,2014630785,Wed Jun 03 02:10:04 PDT 2009,NO_QUERY,elpabl0,Sam the Samurai Fighting Fish - RIP 
0,2014631532,Wed Jun 03 02:10:12 PDT 2009,NO_QUERY,bigenya,@cocoy Yeah! I need to leave in about 30 minutes and Lotus suddenly gives up on me 
0,2014631944,Wed Jun 03 02:10:16 PDT 2009,NO_QUERY,aimanridz,lunges and crunches.ouch 
0,2014632053,Wed Jun 03 02:10:18 PDT 2009,NO_QUERY,misocutesoup,@nicolepenney I know the feeling! I've been in an &quot;I hate people&quot; mood all week! 
0,2014632100,Wed Jun 03 02:10:18 PDT 2009,NO_QUERY,Dr_Jared,@ptolemyalexande  too much coffee can kill ya  and we dont want that
0,2014632211,Wed Jun 03 02:10:19 PDT 2009,NO_QUERY,mo_par,Only caught 1 out of 3 fins  #animalcrossing
0,2014632434,Wed Jun 03 02:10:22 PDT 2009,NO_QUERY,Arneenxx,Im SO stoked to be able to see Anna bannana tomorrow night! I miss her soooo much  Were goin to dinner.. MAJOR catchup session
0,2014632436,Wed Jun 03 02:10:22 PDT 2009,NO_QUERY,pesofati,Hoping it won't rain today 
0,2014632605,Wed Jun 03 02:10:24 PDT 2009,NO_QUERY,rana__xx,@gauneyKAY im so jealous of you!! ggrrr you get to see atl on friday and i dont 
0,2014632611,Wed Jun 03 02:10:24 PDT 2009,NO_QUERY,Whisper63,Morning all..Looks like our run of lovely sunshine has finished for now..dull grey day here 4 me   was enjoying the sun whilst it lasted
0,2014632758,Wed Jun 03 02:10:26 PDT 2009,NO_QUERY,brolinondubs,ughhh...though i had the drunchies...but now i just feel sick  blahhhhh
0,2014633167,Wed Jun 03 02:10:30 PDT 2009,NO_QUERY,lost_dog,@yLanaRae I am lost. Please help me find a good home. 
0,2014633499,Wed Jun 03 02:10:34 PDT 2009,NO_QUERY,Impala_Guy,@19fischi75 checked twitter yesterday 20.00 - ye missed each other again 
0,2014633608,Wed Jun 03 02:10:35 PDT 2009,NO_QUERY,xx_CRISTIINE_xx,oh! how sad they pick her last evytime  i would prob cry
0,2014633955,Wed Jun 03 02:10:40 PDT 2009,NO_QUERY,tracey_bradley,is poorly poorly poorly 
0,2014634007,Wed Jun 03 02:10:40 PDT 2009,NO_QUERY,RachaelEvans," scary motorway incident this morning, im okay though  (I think im being abit of a drama queen this morning!)"
0,2014634190,Wed Jun 03 02:10:42 PDT 2009,NO_QUERY,olivijavan,i miss the days when i lived in sydney &amp; nothing mattered 
0,2014634503,Wed Jun 03 02:10:46 PDT 2009,NO_QUERY,laurakim123,@SwissTwist Sometimes you have to just cut the chord and let it go 
0,2014634697,Wed Jun 03 02:10:48 PDT 2009,NO_QUERY,griggles,Studying for Exams 
0,2014634767,Wed Jun 03 02:10:49 PDT 2009,NO_QUERY,moonlitdance,@JoelMadden lol thought you were going to sleep. sorry to hear you don't sleep well 
0,2014634792,Wed Jun 03 02:10:49 PDT 2009,NO_QUERY,oh_the_irony,"I DONT WANT TO SEE YOUR PUSSIES, ANY OF YOU. STOP FOLLOWING MEEE.  *BLOCKS*"
0,2014634915,Wed Jun 03 02:10:51 PDT 2009,NO_QUERY,sonnes,@oneofth3m yea right...they used to give gold plated ones...now it's silver 
0,2014634924,Wed Jun 03 02:10:51 PDT 2009,NO_QUERY,JonsVeronica,had an accident yesterday and now i am numb 
0,2014634996,Wed Jun 03 02:10:52 PDT 2009,NO_QUERY,chetspengler,@Maverick_AC Download weather this year looks a bit crap!  i was hoping for a scorcher!
0,2014635092,Wed Jun 03 02:10:53 PDT 2009,NO_QUERY,Yorkie35,@Gailporter was thinking that!  all other wedding dresses are very samey 
0,2014635538,Wed Jun 03 02:10:58 PDT 2009,NO_QUERY,char_s1,Is Feeling Tiredd And Not Very Well  !!!
0,2014635802,Wed Jun 03 02:11:02 PDT 2009,NO_QUERY,Zanee,"food poisioning, isnt so great "
0,2014636114,Wed Jun 03 02:11:05 PDT 2009,NO_QUERY,Banzzzai,it¬¥s so cold today....hate that 
0,2014636241,Wed Jun 03 02:11:06 PDT 2009,NO_QUERY,claudineaimee,working and working and working  bored
0,2014636601,Wed Jun 03 02:11:09 PDT 2009,NO_QUERY,mikejenke,#YouTube &gt; couldn't connect to host &lt; in Shanghai tells me http://bit.ly/108tHK  
0,2014636654,Wed Jun 03 02:11:10 PDT 2009,NO_QUERY,Yesenia13,OMG some scary lightning just woke my sister and I up! I'm kind of scared 
0,2014636897,Wed Jun 03 02:11:13 PDT 2009,NO_QUERY,unsaidthingsx,why are planetickets so expensive 
0,2014637066,Wed Jun 03 02:11:15 PDT 2009,NO_QUERY,Denise2779,@Gailporter why oh why do we watch this shit? That guy looks like a half formed foetus! His lips r making me ill  yuck!!!
0,2014637436,Wed Jun 03 02:11:19 PDT 2009,NO_QUERY,nmone,@ZacharyTufflove that fucking sucks dude  strange for you to be MIA! I hope you feel better
0,2014637496,Wed Jun 03 02:11:20 PDT 2009,NO_QUERY,hellocalista,"i hate crying but he never stop make me mad jealous and crying, i hope you know about that "
0,2014637548,Wed Jun 03 02:11:21 PDT 2009,NO_QUERY,Impala_Guy,@19fischi75 me badly sorry bout that hun! 
0,2014637764,Wed Jun 03 02:11:23 PDT 2009,NO_QUERY,electromarkie,"@monicafrancesca Wow, free? Wooh. Nice! I miss eating Haagen Dazs "
0,2014637862,Wed Jun 03 02:11:25 PDT 2009,NO_QUERY,rumpledoodles,sigh feeling miserable today....... 
0,2014638377,Wed Jun 03 02:11:31 PDT 2009,NO_QUERY,Shanz_Valentine,Putting 2gether company presentations isnt the easiest thing in the world.Google is not my friend today 
0,2014638392,Wed Jun 03 02:11:31 PDT 2009,NO_QUERY,sookyeong,@wendychou  all moms do that
0,2014638478,Wed Jun 03 02:11:32 PDT 2009,NO_QUERY,Kesti,"Before I started twitter, my brain actually worked.  "
0,2014638543,Wed Jun 03 02:11:32 PDT 2009,NO_QUERY,63rdfaceofboe,i just finished my polos   i can't reach the othe 18 rolls...  
0,2014639287,Wed Jun 03 02:11:41 PDT 2009,NO_QUERY,crazytwism,"@prateekgupta  Dude,I would have started out on it. Problem is Im bit busy clearing up loose ends at work!  @radha_ @crucifire @brainstuck"
0,2014639297,Wed Jun 03 02:11:42 PDT 2009,NO_QUERY,agirlcalledbob,@Famini oh that happens all to often and it so sad 
0,2014639413,Wed Jun 03 02:11:43 PDT 2009,NO_QUERY,w00dRabbit,gym! yay! then gym shower! major yay! then work  then dentist appointment at 10 *scared*
0,2014639425,Wed Jun 03 02:11:44 PDT 2009,NO_QUERY,black_gemi,the lack of leadership brings to chaos  http://plurk.com/p/y36eb
0,2014639852,Wed Jun 03 02:11:49 PDT 2009,NO_QUERY,angryfaggot,that was close 
0,2014639927,Wed Jun 03 02:11:49 PDT 2009,NO_QUERY,yoyoyiggyyoo,@Grace_Coppinger yeah and im pretty sure ima failing again today  whyyy meee
0,2014640003,Wed Jun 03 02:11:50 PDT 2009,NO_QUERY,Chrissyyyyyyy,My dads truck won't shut up. Omg it's raining hard now. WTF. Haha fuckfuvkfuvk.Noooo ahaha it's doing it againnnnnn.  ha.
0,2014640087,Wed Jun 03 02:11:51 PDT 2009,NO_QUERY,xVivaLaJuicyx,The thunder woke me up  I hate sleeping alone for reasons as such....
0,2014640155,Wed Jun 03 02:11:52 PDT 2009,NO_QUERY,yunjin,back from A Famosa!! Boring &amp; tiring~ 
0,2014640364,Wed Jun 03 02:11:55 PDT 2009,NO_QUERY,naty108,dont feel well   headache... i was very quiet in class.
0,2014640395,Wed Jun 03 02:11:55 PDT 2009,NO_QUERY,CarlaaLOUISE,wants a new backgroundd BUT gotta do hospo recipe first 
0,2014640410,Wed Jun 03 02:11:56 PDT 2009,NO_QUERY,Lizloz,@dontforgetchaos dito but i was just over 200  not sure i want to go check again now I'm getting close.. again
0,2014640615,Wed Jun 03 02:11:58 PDT 2009,NO_QUERY,jayleanne90,soooooooooo tired  actually HATE being narcolpetic today
0,2014640618,Wed Jun 03 02:11:58 PDT 2009,NO_QUERY,hannahismyname,My throat is fucked up.  just woken up  Time to revise soon some 15 year old tosser is whinging on tv
0,2014640677,Wed Jun 03 02:11:59 PDT 2009,NO_QUERY,scouse51976,Its bin red hot and ive caught a cold?! 
0,2014640701,Wed Jun 03 02:11:59 PDT 2009,NO_QUERY,JamiesonZ,so upset now  something's wrong with my camera... i refuse to buy a new one
0,2014641366,Wed Jun 03 02:12:07 PDT 2009,NO_QUERY,musicjBEEh,What I ended up doing 2day: After school finished I went to Jake's then Dylan's &amp; watched 'The Uninvited'. Didn't do h/w or assignments. 
0,2014641390,Wed Jun 03 02:12:07 PDT 2009,NO_QUERY,AlyssaMacDonald,http://www.pokerhand.org/?4314544  ...pretty much witnessed one of the worst bad beats i've ever seen in my life... 5k HU too  sawry Brian
0,2014641727,Wed Jun 03 02:12:11 PDT 2009,NO_QUERY,ramsin_taffles,"@nat_usa26 yeah hopefully, but if its too bad i recommend coming home, ohh i know what a bad headaches like  hope you feel better!"
0,2014641803,Wed Jun 03 02:12:12 PDT 2009,NO_QUERY,Miss_Foxay,@Ms_Cute No whats wrong im worried 
0,2014641868,Wed Jun 03 02:12:13 PDT 2009,NO_QUERY,Roxi_,hate it when internet ussage is all up.... i used the last bit of it wathcing MTV Awards online on Monday  Now i gotta waaaait
0,2014641900,Wed Jun 03 02:12:13 PDT 2009,NO_QUERY,torgo,No wifi and spotty 3g coverage in this room though.  #mweb09
0,2014642048,Wed Jun 03 02:12:15 PDT 2009,NO_QUERY,barnisa,i panic-ate (is that a word?? lol..) because i was so hungry.. now my tummy hurts..  it was fries btw.. lol..
0,2014642066,Wed Jun 03 02:12:15 PDT 2009,NO_QUERY,gwenii,Severe thunderstorm just woke me up! It's scary 
0,2014642275,Wed Jun 03 02:12:18 PDT 2009,NO_QUERY,jayasurian123,Still moving my IMAP mails to Exchange servers.. 
0,2014642296,Wed Jun 03 02:12:18 PDT 2009,NO_QUERY,brumbearskin,"Is it really Wednesday? This means I've got to go to work  Oh well, it helps to pay the bills!"
0,2014642331,Wed Jun 03 02:12:19 PDT 2009,NO_QUERY,SHARNNA,WHERE HAS THE SEXY HOT SUN GONE  ??? 
0,2014642380,Wed Jun 03 02:12:19 PDT 2009,NO_QUERY,leyeaaah,"@twistlickndunk AHAHAHAHA I love your picture.  It's cute. We are the same. I AM NOT EXCITED. Not like everyone else, okay."
0,2014642580,Wed Jun 03 02:12:21 PDT 2009,NO_QUERY,GColdplay,"Still @ school, in about 45 minutes I have lunch in my own!!! √ñ It's seriously not normal and not fair...  Twitter will help me! xoxo"
0,2014642926,Wed Jun 03 02:12:25 PDT 2009,NO_QUERY,roxiijonas,@Topshop_tweets Im watching it now! Its so cruel 
0,2014643163,Wed Jun 03 02:12:28 PDT 2009,NO_QUERY,PrettyDamnFoxy,"Good morning folk, i hope you are all well. I'm feeling a tad weird today... i just want a cuddle  xXx"
0,2014643637,Wed Jun 03 02:12:34 PDT 2009,NO_QUERY,novastern,This is and has been one ofmy favorite images. No idea who the artist is sadly   http://yfrog.com/5couej
0,2014643674,Wed Jun 03 02:12:34 PDT 2009,NO_QUERY,anginellaandal,I miss Janine Simbe.  I shall go unli soooon.
0,2014643941,Wed Jun 03 02:12:37 PDT 2009,NO_QUERY,OCchaleee,why is thunder???? im seeeecareeee 
0,2014644696,Wed Jun 03 02:12:47 PDT 2009,NO_QUERY,alcineyabut,Hungry. Hungry. Hungry. No food at home 
0,2014644710,Wed Jun 03 02:12:47 PDT 2009,NO_QUERY,DimSimxx,Evil Stairs.. fell down them twice today!   Hehe Me and Han watched gossip girl for like 4 hours today lol
0,2014644754,Wed Jun 03 02:12:48 PDT 2009,NO_QUERY,nexblue,@Li_An_T why ??????? you  i also 
0,2014644786,Wed Jun 03 02:12:48 PDT 2009,NO_QUERY,hollowlegs,@grumblemouse Oh no!  Dodgy food?
0,2014644792,Wed Jun 03 02:12:48 PDT 2009,NO_QUERY,glennym,@undefined's curebird report is impressive. i cant get on the site as its blocked 
0,2014644856,Wed Jun 03 02:12:49 PDT 2009,NO_QUERY,only_shallow,@700poodles never.  instead they visited EVERY fckn village in UK. yuck. so not fair!
0,2014644947,Wed Jun 03 02:12:50 PDT 2009,NO_QUERY,JaneBunny,BTW my &quot;save the emac&quot; plan last night has ended w/me completely wiping the hard drive.  I'm bollocked unless I can find some emac discs. 
0,2014645558,Wed Jun 03 02:12:57 PDT 2009,NO_QUERY,fadedmoon,Got another new hoodie. wahahaha. I still want a Clandestine one though.... 
0,2014645781,Wed Jun 03 02:13:00 PDT 2009,NO_QUERY,peachyheid,Booo it's cold again 
0,2014645908,Wed Jun 03 02:13:02 PDT 2009,NO_QUERY,sweetangel_xoxo,can't fall asleep arghhh! 
0,2014645966,Wed Jun 03 02:13:02 PDT 2009,NO_QUERY,casey_kent,I feel crappy like Bill... &quot;I WILL LOVE YOU ALWAYS AND NEVER.&quot; 
0,2014646509,Wed Jun 03 02:13:09 PDT 2009,NO_QUERY,cymberrain,@londicreations I went to take shots of the floss and dead camera 
0,2014646579,Wed Jun 03 02:13:09 PDT 2009,NO_QUERY,monitter,Twitter Search appears to be down and I don't even get a failwhale...  Anyone else having problems?
0,2014646777,Wed Jun 03 02:13:11 PDT 2009,NO_QUERY,hdloverforever,bed time twittererzz 
0,2014646869,Wed Jun 03 02:13:12 PDT 2009,NO_QUERY,__missb,@jacquesvh so gutted  i better tell Johan there's no audi for him... lol. i'm buying lots of tix for next week!! i'm sleepy too...
0,2014646881,Wed Jun 03 02:13:13 PDT 2009,NO_QUERY,LeoIt60,At work..... Meeting  sooo bored (
0,2014646882,Wed Jun 03 02:13:13 PDT 2009,NO_QUERY,GavinCrossley,R.I.P to my leather jacket...killed by idiot drycleaners....sorry jacket 
0,2014646901,Wed Jun 03 02:13:13 PDT 2009,NO_QUERY,Ellwoogie,just saw the beyonce &quot;ego&quot; video.. damn it why havent i got tickets to see her 
0,2014647421,Wed Jun 03 02:13:18 PDT 2009,NO_QUERY,vonno,my headphones broke 
0,2014647460,Wed Jun 03 02:13:19 PDT 2009,NO_QUERY,Melo__X,"Morning tweets... Off to the gym, hurt my leg sleeping "
0,2014647678,Wed Jun 03 02:13:21 PDT 2009,NO_QUERY,aksh_effect,goin back home  ... standin on hyderabad intnl airport ... miles ahead when compared to bial blore ...
0,2014647681,Wed Jun 03 02:13:21 PDT 2009,NO_QUERY,dontforgetchaos,@Lizloz They're sneaking up on me at night....... They have no shame  ....... Morning 
0,2014647750,Wed Jun 03 02:13:22 PDT 2009,NO_QUERY,justjanis,has been left on her own today 
0,2014647837,Wed Jun 03 02:13:23 PDT 2009,NO_QUERY,katbrightlights,"My osteopath just told me off  that's not going to help me relax, is it?!"
0,2014648390,Wed Jun 03 02:13:30 PDT 2009,NO_QUERY,Murphskie,Morning all! Voice nearly gone thanks to cold in 27 degree weather 
0,2014648612,Wed Jun 03 02:13:33 PDT 2009,NO_QUERY,evesebire,"Tell me some good organic ways to feel better. Seriously, I'm sick of feeling so run-down all the time. "
0,2014648623,Wed Jun 03 02:13:33 PDT 2009,NO_QUERY,melgal7,done with my first exam.... 4 more exams to go 
0,2014649067,Wed Jun 03 02:13:38 PDT 2009,NO_QUERY,CaitlinPavlich,@tommcfly dude i kinda don't think your alive since you don't say anything back to me 
0,2014649108,Wed Jun 03 02:13:39 PDT 2009,NO_QUERY,peajaay,@ChoChoMojo aaawwww you poor thing You going to be ok?? 
0,2014649195,Wed Jun 03 02:13:40 PDT 2009,NO_QUERY,_Naz,Taking jd to the vet   http://mypict.me/2rRb
0,2014649547,Wed Jun 03 02:13:44 PDT 2009,NO_QUERY,Jess_Sumner,at school revising its so boring 
0,2014649602,Wed Jun 03 02:13:45 PDT 2009,NO_QUERY,united06,"@patriciargh Ooooooh no I start at 1. But the class is already full lol, 46/40! "
0,2014650133,Wed Jun 03 02:13:51 PDT 2009,NO_QUERY,ronutin,@maggiebrookes awww... i hadn't read the &quot;my computer crashes&quot; part  that sux
0,2014650825,Wed Jun 03 02:14:00 PDT 2009,NO_QUERY,sioweelin,going to selayang tonight to dine with brother doctor. will be missing my dear Harmonix in performance at choral fest.  I love you kids!
0,2014650830,Wed Jun 03 02:14:00 PDT 2009,NO_QUERY,vinoaj,@googledownunder your blog keeps giving me a 502 error   Not seeing the same error with any other blogspot blogs
0,2014651085,Wed Jun 03 02:14:03 PDT 2009,NO_QUERY,rbbrmlk,FINALLLLLLLLYYYYYYY. Now I'm too lazy to start my work. 
0,2014651109,Wed Jun 03 02:14:03 PDT 2009,NO_QUERY,shutupmeg,(@Chrissyyyyyyy) My dads truck won't shut up. Omg it's raining hard now. WTF. Haha fuckfuvkfuvk.Noooo ahaha it's doing it againnnnnn.  ha.
0,2014651285,Wed Jun 03 02:14:05 PDT 2009,NO_QUERY,Lastoadri,So they just announced that ppl who are living away from work not to come tomorrow.. Why O why I am living near the place  #CairoSpeech
0,2014651446,Wed Jun 03 02:14:07 PDT 2009,NO_QUERY,pspen85,@everything_i_am lol yup I do...it was supposed to be my off day but my boss asked me to open one of the stores  at least ill be off by 5
0,2014651601,Wed Jun 03 02:14:09 PDT 2009,NO_QUERY,niklasfrisk,"Good morning, got to go pick up my car in the city  Tweet you later !"
0,2014651892,Wed Jun 03 02:14:12 PDT 2009,NO_QUERY,vsandz,Frustrating night yest trying to update N95-3 firmware. Lots of uninstall/reinstall/restart but no luck with Nokia ADL driver to install 
0,2014652520,Wed Jun 03 02:14:19 PDT 2009,NO_QUERY,Mikinakimoni,"exam in economics tomorrow,, worried abt all the stuff i don know "
0,2014652708,Wed Jun 03 02:14:22 PDT 2009,NO_QUERY,myonlyeverglow,"@Tuckle Awwww, poor @McFlyer4ever - no worries, he ALWAYS forgets to call me "
0,2014653009,Wed Jun 03 02:14:26 PDT 2009,NO_QUERY,cocoward,"@_xbianca i know  he spoilt my day,"
0,2014653277,Wed Jun 03 02:14:29 PDT 2009,NO_QUERY,bhuto,"This weekend I leave Pune for Mumbai and you guys have a tweetup here!  Nothing in Mumbai this weekend, is there?"
0,2014653327,Wed Jun 03 02:14:29 PDT 2009,NO_QUERY,allstationsdown,"@lizlove_ we wish! actually, two of us will be out at the denver and LA shows, doubt they would get a scottish band to play  - asd"
0,2014653332,Wed Jun 03 02:14:29 PDT 2009,NO_QUERY,vike_ketel,@HepityHop where are you? gone to bed ? demn computer! oh that was a very poor conversation!  i should talk to dad!
0,2014653539,Wed Jun 03 02:14:32 PDT 2009,NO_QUERY,cherryboneta,Mango sale?! So not a good time!!!  hiks..
0,2014653743,Wed Jun 03 02:14:35 PDT 2009,NO_QUERY,designbyday,Arrrrgh - doctor/pharmacist has given me wrong medication! 
0,2014653954,Wed Jun 03 02:14:37 PDT 2009,NO_QUERY,raniishere,im thinking about him 
0,2014654010,Wed Jun 03 02:14:38 PDT 2009,NO_QUERY,nicoloolie,@iriissx3 the only 7I i have is megan cagurangan and joao crisologo.  konti naman amp hahaha
0,2014654078,Wed Jun 03 02:14:39 PDT 2009,NO_QUERY,yeyeismynicki,is deeply disappointed. i didnt get the time to go hiphop-ing 
0,2014654086,Wed Jun 03 02:14:39 PDT 2009,NO_QUERY,fSTACK_,"Nooo school photos tomorrow  , i hope it doenst rain so we could skip a bit of maths! "
0,2014654174,Wed Jun 03 02:14:40 PDT 2009,NO_QUERY,socialspace,Missed yet another noise show at Chicks Hotel (Port Chalmers)  This one features Adrian Hall and EYE -which is underway right now!
0,2014654230,Wed Jun 03 02:14:41 PDT 2009,NO_QUERY,CaitlinPavlich,@tommcfly dude i don't think your alive since you don't ever reply to me  but hey your still pretty amazing
0,2014654399,Wed Jun 03 02:14:43 PDT 2009,NO_QUERY,natealcantara,Its going away  thank you nature for giving me a lightshow packed with crackling booms! and now... rain.
0,2014654518,Wed Jun 03 02:14:45 PDT 2009,NO_QUERY,tracymulligan13,"@tjbaby101 Yeah nothing to do with being dumb ;-). thanks she is fine, i'm off to do housework "
0,2014654706,Wed Jun 03 02:14:47 PDT 2009,NO_QUERY,ruthjoy86, I can't open my YM account ! Grr.
0,2014655187,Wed Jun 03 02:14:53 PDT 2009,NO_QUERY,gullevek,stupid softbank has the same retarted domain prefixes like vodafone had ... 
0,2014655521,Wed Jun 03 02:14:57 PDT 2009,NO_QUERY,alanz_bananz,i still really don't understand &quot;the game&quot; 
0,2014655563,Wed Jun 03 02:14:57 PDT 2009,NO_QUERY,yazmac11,Working at 11- bore - i have soo much to do when i get home at 4 
0,2014655722,Wed Jun 03 02:14:59 PDT 2009,NO_QUERY,BonaClaudine,"mis_ justwentto Montanas, and I didnt order dessert (deep fried cheesecake) I still regret it!! "
0,2014655975,Wed Jun 03 02:15:02 PDT 2009,NO_QUERY,EnnDragon,"Half a day to clean a bkshelf! &amp; I'm not even done! Pathetic. 2 more shelves to go  Arh, tmr will tackle. Nw gettin ready for jog!"
0,2014656616,Wed Jun 03 02:15:08 PDT 2009,NO_QUERY,Layitonheavy,"@martibelle let's cut back on those last 3 words, you're bringin' me downnnnnn.  Also, you'll be on point tomorrow with the 2.5 hrs :-D"
0,2014656668,Wed Jun 03 02:15:08 PDT 2009,NO_QUERY,SerenaMcFLY,@owfx Oh and no he never has replied to me  i hope he will someday  xx
0,2014656817,Wed Jun 03 02:15:10 PDT 2009,NO_QUERY,omgkatie,@miahrose stupid geography  what were you saying oi at on dan's picture? Lol
0,2014656989,Wed Jun 03 02:15:12 PDT 2009,NO_QUERY,markusmcgrew,Sam was fussy leading the wife to go out on the couch w/ him. Mia in turn woke up wanting water. Now i'm awake but she went back to sleep 
0,2014657084,Wed Jun 03 02:15:13 PDT 2009,NO_QUERY,merjastone,To much course work 
0,2014657375,Wed Jun 03 02:15:16 PDT 2009,NO_QUERY,IsaMilano,@JonsVeronica Oh I'm sorry to hear that  Did you go to the doctor's? Hope you feel better soon
0,2014657399,Wed Jun 03 02:15:16 PDT 2009,NO_QUERY,Carrieissovery,yes its 5am and for some reason I'm freaking wide awake 
0,2014657557,Wed Jun 03 02:15:18 PDT 2009,NO_QUERY,Joelito19,Well my day started off bad. Locked my keys in my car at the gas station.  My spare? Home.
0,2014657697,Wed Jun 03 02:15:20 PDT 2009,NO_QUERY,grassking913,3 more hours. 
0,2014657782,Wed Jun 03 02:15:20 PDT 2009,NO_QUERY,nunu_boujuah,@honorablecnote u aint tweetin ur self I'm here 
0,2014658106,Wed Jun 03 02:15:24 PDT 2009,NO_QUERY,AudioFun,Ridiculously sick. Spent the last 10hrs going to n from the bathroom. Exam on friday too 
0,2014658260,Wed Jun 03 02:15:26 PDT 2009,NO_QUERY,NastassjaLoots,"Feeling really miserable, wishing I was at home "
0,2014658435,Wed Jun 03 02:15:28 PDT 2009,NO_QUERY,sashalubis,repletion ~.~ gagal diet huhuhu 
0,2014658687,Wed Jun 03 02:15:32 PDT 2009,NO_QUERY,MissCay,"@mofgimmers Nope, not for free alas. It's come out of my own pocket. "
0,2014658738,Wed Jun 03 02:15:32 PDT 2009,NO_QUERY,Perignonic,@Wilsurn you are so lucky!! 
0,2014659003,Wed Jun 03 02:15:35 PDT 2009,NO_QUERY,japamm,missed home &amp; away again!! 
0,2014659118,Wed Jun 03 02:15:36 PDT 2009,NO_QUERY,Cardinal502,"just got home from work, i'm tired, it's probably going to rain tomorrow so i won't see my daughter play softball "
0,2014659151,Wed Jun 03 02:15:37 PDT 2009,NO_QUERY,lynchy010,"[Gaming] Have to download MGO again. Last time it took all day, i went out and someone plugged out the ps3! "
0,2014659167,Wed Jun 03 02:15:37 PDT 2009,NO_QUERY,bigenya,"@cocoy *Sigh* @overlordtrainee, please make Lotus work. What about my date?! "
0,2014659266,Wed Jun 03 02:15:38 PDT 2009,NO_QUERY,Ruthiexo09,@veronicasmusic Awww that has gotta suck  Qld will so win though[i hope]
